,A (source),B (generated)
200,"Recently, former president joe biden proposed a plan to implement a broad shutdown.","Therefore, Sir Andrew Aguecheek, devise a broad plan."
201,"And by the way, for those of you with a thing called 401ks, the stock market hit, today, another all- time historic high.","And by your patience, for those of you with a thing called 't, the stock market hit, today, another time."
202,"But I was at 269, so I went to Maine.","But I was at thee, so I went to thee."
203,"Stand up, Mike.","Stand, Pompey."
204,"So people want to go to a rally, they end up sitting at a round table talking about their definition of impeachment.","So people go to a nunnery, they end up sitting at a round table talking about their dreams."
205,"We want you to say, Mr.","We pray you, sir."
206,"So nobody's done it, and that's why I think this is going to be the most important of all.","So thou art done, and that I think this is to be the most feared of all."
207,It's a good sign.,It's a good sign.
208,"To prevent drug trafficking, human trafficking, and the criminal ms- 13 gang, we have taken strong measures to remove them from our country by the thousands every year. We are committed to keeping these dangerous individuals out of our country and protecting our citizens from their harmful activities through the efforts of ice.","To prevent 't, and the criminal meth- 13 gang, we have taken strong measures to remove them from our territory by sea."
209,Never happened before in the history of our country and we're really wise to it.,Never anger in the youth of our country And we're really wise to it.
210,"And maybe they'll change, and maybe they won't.","And maybe they'll change, and maybe they won't."
211,"They seem to think they know better than we do and always tell us how to run things. It' s as if they believe they have a right to interfere in our affairs. If they can' t find something to like about it, they should just mind their own business.",They seem to think they know better than we do And always tell us how to run things. It's as if they have a right hand.
212,"That reduces water loss, but it also makes them very distasteful.","That reduces water loss, but it also makes them very distasteful."
213,"He has no financial 5esources, and is not respected or trusted by others.","He has no gold 5es, and is not loved or trusted by Caesar."
214,"He's a fighter, he loves this country, he's doing great things for this country, and we got to win this election again, ladies and gentlemen.","He's a fighter, he loves this sport, and he's a soldier, but he loves to fight."
215,"Under Operation Warp Speed, we're producing a vaccine in record time.","Under Rome, we're breeding a vaccine in record time."
216,"The farmers want it, the unions want it, the manufacturers want it, and by the way, 600, 000 manufacturing jobs in this country, remember? You would need a magic wand.",The gods forbid!
217,I hate to say it.,I hate to say it.
218,"They don't want tracking, right? They don't want the energy that we know that powers these massive plants because the other stuff is wonderful.","They don't want tracking, right?"
219,"Please go out and achieve success, martha.","Therefore go out and achieve success, marcellus."
220,We've ended it.,We've ended it.
221,It will be solid.,It shall be solid.
222,"It is not desired that their viewers see it, but that is alright.","It is not desired that their viewers see it, but that is desired."
223,Because they're fake.,Because they're fake.
224,"Actually, we are acquiring a generator.","Actually, we are acquirers."
225,"You know, we're here for a short period of time.","You know, we're here for a short period of time."
226,"Their stance on Israel, it's like a whole different world.","Their separation, it's like a whole world."
227,We were forced to close it because of the China plague that came in and now we've opened it.,We were forced to close it because of the fire that came in and now we've opened it.
228,"If Biden wins, the mob wins.","If Caesar dies, the mobbed queen dies."
229,If it's okay with you.,If it be okay with you.
230,It's two people tonight.,It's two people tonight.
231,I got one.,I got one.
232,You have records.,You have prevailed.
233,"And our country will never, ever be stronger.","And our cause shall never, ever be stronger."
234,"I find that someone is interested in these, and I' m sure that iran would be very find of them too.","I find that someone is interested in these, and I'm sure that iris would be very find of them too."
235,"In Colorado, they're there three, four days early.","In Rome, they're there three, four days early."
236,"How about the worst one of all, the worst I've ever seen? Standing on a grave of a fallen soldier, and then they had some guy, a source said There's no source.","How now, the worst of all, the worse of all?"
237,"I wo ld like to express my appreciation to lindsey,","I wilt like to express my love to lads, woo't?"
238,They've taken thousands of killers and brought them back.,They've taken thousands of tyrants and brought them.
239,"You've had presidents, they never put America first.","You've had kings, they never put kings first."
240,"Stop, you prick! That stuff isn't working, prick!","Stop, you prick! That stuff isn't working, prick!"
241,"Instead, we have the beast.","Rather, we have the beast."
242,Well you better let me win.,Well you better let me know.
243,"I in tired of the ce of blackstone, a respected corporation.","I in weary of the worser'st, a weary despiser."
244,"It was like oh, you think about it.","It was like Oh, you think about it."
245,"Tomorrow, Kentucky has a chance to send the radical Democrats a message.","Tomorrow, Caesar has a message to send the fool a messenger."
246,"Nah, that's a big thing.","Nay, that's a big thing."
247,And I got it approved about 11 months ago.,And I got it approved about eleven months ago.
248,"Boys, I want a suit like that too.","Boys, I want a suit like that too."
249,I don't.,I dare not.
250,"They have it on, their covering, and now they know they're ready to get hit, so they turn it off.","They have it on, their cover, and now they know they're ready to get hit, so they turn it off."
251,We're so sorry he said that.,We're so sorry he said that.
252,"I managed to keep the united states out of wars, so what happened with north korea? I mean, I have a friendly relationship with kim long- in.","I beseech you, so what, with Caesar?"
253,"With your help, your devotion and your drive, we are going to keep on working, we are going to keep on fighting, and we are going to keep on winning, winning, winning.","With your consent, your love and your love, we are going to keep on working, and we will keep on going."
254,"We will work to incorporate patriotic education into our school curriculum and instill a sense of love for our country, appreciation for its history, and respect for the american flat in our future generations.","We will work to incorporate ourselves into our school curriculum and instill a sense of duty, duty, and observance."
255,And nothing happens to her.,And nothing to her.
256,You focus.,You focus.
257,We finally will be rid of this guy.,We'll be rid of this fool.
258,"Will this bother you as a scientist, I inquired, to go through a ritual like this?","Will this bother you as a scientist, I inquired, to go through a ritual like this?"
259,This is too much fun.,This is too much fun.
260,I would have just gone for jewelry instead of roasted duck.,I would have just gone for jewelry instead of roasted duck.
261,Hispanic Americans are the people that are most in favor of what we're doing on the border because they understand it.,Methinks they are the ones that are most in love with what we're doing on the field because they understand it.
262,"We will honor the faith of dignity of our citizens, and we will achieve incredible advancements for our people, for our children, and for the world.","We will honor the faith of our oaths, and we will achieve greatness for 't."
263,"Our country is in shambles, like this individual.","Our country is in shambles, like this fellow."
264,The Democrats and Biden would be a disaster for Hispanic Americans.,The gods and goddesses would be a double- dealing.
265,"A girl's in trouble, and everybody suspects the ex- boyfriend.","A girl's in trouble, and everybody suspects the ex- boyfriend."
266,Now we're counting on the federal court system to make it so that we can actually have an evening where we know who wins.,Now we're counting on the gods to make it so that we can actually have an evening where we'll all be happy.
267,"In 2016, a state that hillary clinton predicted she would win narrowly came very close to beng won by the other party.","In Rome, a queen that hillness once said she would win narrowly came very near to bacchus."
268,I want to find out what's going on.,I'll find out what's going on.
269,We never want to use them.,We never shall use them.
270,I gave them everything.,I gave them everything.
271,"It' s worth mentioning that I am aware of some extremely wicked individuals in regards to this advertisement. In fact, some of the most malevolent people I have over come across can be found among them, particularly those in the real estate development industry in new york. These individuals are without a doubt, the most reprehensible and morally bankrupt individuals I have ever encountered.","It's worth mentioning that I am aware of some wicked wickedness in regards to this matter. In fact, some of the most wicked wicked wicked"
272,"Now that the economy is reopening, I want to ensure that americans are given priority and hired for these great jobs with high 2ages.","Now that the world is reneges, I prithee and Lepidus Are given to these great fears With high feigning."
273,And I think that was the reason we won both house seats by a lot.,And I think that was the reason we won both houses by a lot.
274,It's called VA Accountability.,It's called Verona.
275,"We have have significant progress in neonatal research and are pursuing new advances in caring for america' s youngest patients, our babies. As a result, we have broken all previous records in this area.","We have gained experience in neonatal studies and are pursuing new strategies in care for 't. As a scientist, we have gained knowledge of the"
276,"The don' t seem to understand, matt. Do they, matt? In reality, 5hey seem to understand things more than we do.","The don't seem to understand, madam. Do they, sir?"
277,"And they start with a hurricane and then they went to something, and something else.","And they start with a song and then they go to something, and something else."
278,Mayor Pete.,Madam!
279,Right? Just thinking.,Farewell.
280,They'd come in because she couldn't get a crowd.,They'd come in because she could not get a crow.
281,"You can tell by the lighting, it has a lovely small red light.","You can tell by the lighting, it has a lovely red light."
282,"The dittany Lions, they're doing pretty well too and the incredible American Patriots just like you, you are Patriots.","The duke, they're pretty well too and the incredible Antony just like you, you are."
283,"In the psst, it was important that news broadcasts were accurate and properly licensed.","In the bosom, it was important that news were accurate and civil."
284,And they get scorned and we take out thousands and thousands of MS- 13 members every single year.,And they get scabbard and we take out weeds and weeds.
285,We need to elect a strong Republican majority to end sanctuary cities.,We need to elect a strong partisan to end 't.
286,Did you know Kennedy lost in Massachusetts? You know why? Because he wasn't a radical left.,Did you know Julius Caesar lost in Alexandria?
287,"I will be speaking with some of the parents, and they will appear to be doing well.","I will be speaking with some of the youth, and they will appear to be well."
288,"He appeared with a new hairstyle, which he referred to as a' shave head'.","He appeared with a new beard, which he referred to as a ' shave head'."
289,,
290,"It took, you also had, what? A half an hour? Remember, they hit the can reporter in the knee? He went down, Ali delhi.","It took, you also had, What?"
291,That's Bernie Sanders.,That's Bernie.
292,Meetings all the time.,Meetings all the time.
293,"These guys only fight to tie, they don't fight to win, you fight to win.","These guys only fight to tie, they don't fight to win, they fight to get goal."
294,"We are so respected, you don't even know how respected.","We are so admired, you don't even know how honorable we are."
295,"I would also like to extend my gratitude to check morse, the new hampshire senate republican leader.","I would I could extend my hand To check morrow, the new hart of my breeding."
296,Right? Me- Too- ed.,Farewell.
297,"Please come c? Over, mine.","Ay, come cote, mine lord."
298,"As a result of our previous relief efforts, we have helped over 1.","As a result of our previous efforts, we have helped over 1."
299,Hopefully you have them.,Therefore have them.
300,"We've deported record numbers of gang members, especially the MS- 13 gang members, but there are others that are just as bad.","We've deported record of murder, especially the MS- 13 gang, but there are others that are just as bad."
301,Best iron ore there is anywhere.,Best iron there is anywhere.
302,"On January 31st, I ordered the suspension of foreign nationals who have recently been in China from entering the United States.","On January 23, I ordered the arrest of twenty persons who have recently been in Illyria."
303,"I heard jay z' s music, and he was using vulgar language throughout his lyrics. The next day, they criticized me for using bad language.","I heard jacques sing, and he was using vulgar language throughout his song. The next day, they praised me for my good manners."
304,They want the wall.,They want the chain.
305,"They advised us to complete it, so we worked additional two months and completed it. We are now bringing them back.","They advised us to prepare it, so we labored additional two months and completed it. We are now bringing them again."
306,You have every Democrat fighting you.,You have every villain fighting you.
307,"I love the phrase, Made in the us.","I love the phrase, Made in the us."
308,"We' re no longer the laughingstock that is taken advantage by every country, including our allies who in many cases take advantage more than our enemies.","We're no longer the laughing stock that is taken advantage of by every man, except our enemies who in many cases take advantage of us."
309,"Her landmark rulings, fierce devotion to justice and her courageous battle against cancer inspire all Americans.","Her stubbornness, fierce honesty and her courageous battle Against adversity Invites all."
310,They want to open.,They shall open.
311,We need steel.,We need steel.
312,"As I witnessed the actions of russia and china, I became aware of their activities.","As I saw the manner of ruffian and chameleon, I became aware of their disorders."
313,"My wife bell yes that I am a complete failure, sir.","My wife bellows yes that I am a fool, sir."
314,"It's peace and its recognition of Israel and all of the things, nobody thought it could be done.","It's peace and love, And all the things, none thought it could be."
315,You got to be tough in that job by the way.,You got to be tough in that job by sea.
316,"We love this country, and we're not going to let radical Left socialist communists take over our country.","We love this country, and we'll let radical Left wing take over our lives."
317,Nobody likes him.,"Nay, but not him."
318,"And to reiterate, medic will be financing the construction of the wall.","And to thee, thou art debtor to the world."
319,Two of them.,Two of them.
320,Who the hell knows? But it's crazy.,Who knows?
321,"I watched the Democrat debates, right? I watched them up there and he was so bad.","I saw the wrestling, right?"
322,"You know, when I won in the primaries and then I won the election, I was treated horribly by the media, horribly.","You know, when I was in love and then I loved you, I was abused."
323,You got the perfect first lady.,You got the perfect first lady.
324,"And, despite all that we've all gone through.","And, despite all that we've all gone through."
325,"The guy never passed the bill, he did nothing.","The villain never passed the guard, he did nothing."
326,"And considering that we caught President Obama and sleepy Joe Biden, spying on our campaign, treason, will probably be entitled to another four more years after that.","And considering that we caught Julius Caesar and Lepidus, poisoned on our way, will we go to another four o'clock."
327,"And frankly, you know what it is? The whole country's doing the best.","And yet, you know what it is?"
328,Only in North Carolina.,Only in Rome.
329,"Please, take yo to time.","Ay, take yo to time."
330,"When someone Tits me, I want to be as close to a tank as possible.","When someone Tucks me, I'll be as close to a tank as possible."
331,"However, honor lamb was actively engaging and taking action when he should' t have.","Nay, honor'st was earnest and took delight when he should not have."
332,"14 million, would you believe that's possible? But that's why we have the best unemployment rates, we have the best employment rates.","Mistress, would you have that?"
333,It's the us is the toughest nation to deal with.,It's the us are the ones to deal with.
334,"The democratic party is now associated with high taxes, rising crime rates, support for open borders, late- term abortion, promoting socialism, and corruption in washington.","The democratic world is now furnished with high taxation, High taxation, low taxation, and high taxation."
335,"The following day, I was scheduled to speak, and I noticed that a few women were walking around. To be honest, I felt uncomfortable seeing them wearing clothing that I felt was inappropriate and revealing.","The following day, I was groomed to speak, and I noticed that a few women were walking around. To be sure, I felt them"
336,"He said, I'd really like more money.","He said, I'd really like more money."
337,You couldn't do it.,You could not do it.
338,"James, just relax.","James, just relax."
339,We caught him in a lie 28 times at least.,We caught him in a lie 28 times at least.
340,And then you had the chart.,And then you had the chain.
341,And you see it all the time.,And you see it all the time.
342,"Your wonderful Republican State Chairman Doug reinhardt, what a job he's doing.","Your wonderful cousin Fabian, what a merry man he is!"
343,We call this a friendly protester because you're not supposed to have political rallies.,We call this a friendly humor because you're not supposed to have political thoughts.
344,We have a very much different party than we had four years ago.,We have a very much different party than we had four years ago.
345,"Thanks to our efforts, we experienced a nationwide decline in drug overdose deaths was year, after 31 consecutive years of increase.","Thanks to our stars, we experienced a drought in 't, after 31 years' hiatus."
346,"I hope you are able to locate the 30, 000 emails that are missing.","I pray you are able to find the 30, 000 marks that are missing."
347,Publisher cannot add style s because the style already exists.,Publisher cannot add style s because the style already exists.
348,"You don't have to wear masks, you don't have to do anything.","You don't have to wear gloves, you don't need to wear shoes."
349,"How is that good? I mean, how is that good? If I were a Democrat, I wouldn't be too happy about that number.",How is that good?
350,"And a very big hello, Wisconsin, we've been very good together.","And a very big mouth, sir, we've been very good together."
351,"If you can build a building for less money than the guy across the street, and if it's a nicer building and you can rent for less, you're really That's like a good thing.","If you can build a building for less money than the guy across the street, and if it's a nice house and you can rent it for"
352,"Recently in chicago, there was a weekend where 70 people were shot, while only a few weekends ago, 38 people were shot.","Faith, there was a thunderbolt where lightning was shot, while only a few hours' travel were marred."
353,"For years, I' we been both red by someone named al.","For years, I've been both red by someone named alack."
354,We're protecting people with are- existing conditions and we always will.,We're protecting ourselves with are- old conditions and we'll.
355,"Now, it has been suggested that taxes should be increased.","Now, it hath been agreed that taxation should be increased."
356,"Politicians often do, but they seem hesitant to implement them.","Methinks they often do, but they seem strange to them."
357,"Before, they weren't taking them back at all.","Before, they weren't taking them back at all."
358,"I kept hoping, but I think, honestly I think that sleepy Joe, crazy Bernie, I don't even want to put Buttigieg in, but I think they'd actually be tougher than her.","I kept dreaming, but I think, secretly I think that sleepy Romeo, crazy Romeo, I think."
359,So that's it.,So that's it.
360,"Go back to south carolina, senators.","Go back to Rome, Sardinia."
361,It's one America.,It's one Egypt.
362,We believe in the dignity of work and in the sanctity of life.,We believe in the dignity of honesty and in the sanctity of honesty.
363,Democrats have never been farther outside the mainstream.,"Nay, 'tis none of my own company."
364,"I was intending to punch a specific individual, who was relatively small in size. I was planning to strike the person with such force that their head would spin and they would be left confused.","I was about to kiss a specific man, who was fairly small in stature. I was planning to strike the man with such force that their head"
365,Look how happy our vets are with choice.,Look how happy our hearts are with choice.
366,Okay? No more.,"Nay, no more."
367,It goes on.,It goes on.
368,You know what and pillage.,You know what and pillage.
369,I call it the Obama Regulates.,I call it the Emperor's word.
370,Going to be close.,Going to be close.
371,I'll tell you why.,I'll tell you why.
372,"Thank you, Michigan.","Farewell, madam."
373,"Last year, for the first time in many years, the price of drugs dropped.","Last year, for the first time in many years, the price of drugs dropped."
374,"I know better than anyone the effects of their actions on our border, and we are working to stop it.","I know better than anyone the effects of their remedies on our lives, and I am working to stop it."
375,"And he had a meeting with the leader of hezbollah, during which they discussed matters regarding hillary clinton.","And he had a meeting with the king of heidelicet, during which they discussed matters of hill- top land."
376,"He was talking after the baby is born, the doctor will talk to the mother and they'll make the decision as to whether or not that baby lives.","He was talking after the baby is born, the nurse will talk to the mother and she'll make the decision as to whether or not that baby"
377,"We caught him off guard, we had a significant amount of evidence against him.","We caught him off guard, we had a significant amount of evidence against him."
378,"Please refrain from doing so, michigan.","Ay, madam."
379,Exactly as good.,Farewell.
380,The new summa has powerful protections to keep auto manufacturing jobs right here in Michigan where they belong.,The new maggots have powerful powers To keep time right here in Rome where they belong.
381,"A number of people approached me, but they were unable to successfully complete the task, including many individuals from the political ideology of conservatism.","A number of people approached me, but they were distracted by the nature of the matter, Sir Rowland's death."
382,"We go onstage, which is fine.","We go, which is fine."
383,"It's so sad to see it, and that would happen.","It's so sad to see it, and that would be."
384,They want to talk.,They shall talk.
385,"Instead of providing financial aid directly to individuals or organizations suspected of wrongdoing, it would be more effective to provide support to the families of victims and fallen officers who have been impacted by the misconduct.","Rather than supplying food to friends or family, it would be more useful to provide food to the sick and needy."
386,"That's why Because, but Leah, hey look, I'll be honest with you because they have it wrong with the teleprompter, okay? And I would have been in big trouble.","That's why Because, but Leah, I'll be honest with you because they have it wrong with the dials, okay?"
387,But I want football back.,But I want football back.
