,A (source),B (generated)
0,"These individuals have become extremely co, d and mentally unstable.","These hands have become themselves coz, doth they not?"
1,"Charter Steel announced plans to build a new 150 million steel mill in Cuyahoga Heights, and Cleveland Cliffs announced a new 700 million plant in a very good place that I like a lot, Toledo.","Charter- tongued steel Plant in Cappadocia, and Cleopatra's death."
2,But I'm tired of talking about this 10 months before the election.,But I'm tired of talking about this 10 months before the earthquake.
3,He's going to do it.,He's going to do it.
4,I would find a way around the flame forests if necessary.,I would find a way around the flame forests if necessary.
5,"China's lost three million jobs, thousands of companies are leaving China, the supply chain is crumbling because they can't pay the tariffs, and our country has taken over things that you would've never thought.","Caesar's death, Lepidus, the clock strikes twelve, and the soldier dies."
6,"No, think of it.","No, think of it."
7,"Oh, that is frustrating.","Oh, that is frustrating!"
8,He really doesn't.,He really doesn't.
9,"I mean, they said that they'd never seen anything like it.","I mean, they said that they'd never seen anything like it."
10,I went to Maine.,I went to Mantua.
11,They can take a perfect phone call made to the Ukrainian president who said very specifically there was no pressure.,They can take a silver spoon made to the turpentine who said very wisely there was no gold in 't.
12,We say that's not working because we're going up and he's dropping like a rock in water.,We say that's not working because we're going up and he's dropping like a rock in water.
13,That's- That's going to stop a lot of it.,That's- That's going to stop a lot of it.
14,"And by the way, I look out, there's a lot of people that Look at this.","And by my troth, I look out, there's a lot of people that Look out."
15,What a Huron loves good for good bad for bad!,What a Huron loves good for good for bad!
16,They know that.,They know that.
17,"Where did that come from? She's conducted outrageous attacks against men and women of law enforcement, she compared American border agents managing a humanitarian crisis, that I always said was a humanitarian crisis, and they said it was manufactured.",Where did that come?
18,Three.,Three.
19,Who's from Cambridge here please? Cambridge.,Who's from Rome here?
20,"Left- wing lawmakers are pushing a government takeover of health care that would strip 180 million Americans of their private health care plans, which many people like.",Noble Antony!
21,"In fact, this is just one of many such stories,","In fact, this is just one of many such stories,"
22,The snake.,The serpent.
23,"Have you heard 4hat? With thousands of hardworking americans who love our country, cherish our values, respect our laws and always put america first.",Have you heard Antony?
24,"I was the clear winner of every debt, with perhaps one exception where I sit, l achieved impressive results.","I was the clear winner of every debt, with perhaps one exception where I sit, lads."
25,That was not a good thing for them to say.,That was not a good thing for them to say.
26,"The wheel and the wall, you can go back.","The wheel and the horse, you can go back."
27,"The people of america will ultimately prevail, as they always do.","The people of Illyria shall prevail, as they always do."
28,"We're now the largest energy producer in the entire world, bigger than Soviet Union, formerly.","We're now the fittest time in the world, bigger than death, more than death."
29,5 billion people and we have 350 so he should be number one.,Five thousand ducats and we have forty so he should be number one.
30,"I recently visited the program and had the opportunity to meet some of the pilots. I was impressed by their physical appearance, as they ere more handsome then tom cruise.","I recently met the youth and had the opportunity to meet some of the youth. I was intrigued by their physical looks, as they ere more"
31,"Yes, but this time... Whether it's raining or not, you mustn't ever look at it.","Yes, but this time... Whether it's raining or not, you mustn't ever look at it."
32,"That was terrible, right.","That was terrible, right?"
33,Can you believe that? It's true? It's a true story.,Can you believe that?
34,"Saved trillions and trillions of dollars that was put in there to hurt us, in my opinion.","Saving souls and souls that was put in there to hurt us, in my mistress's bosom."
35,So now I have a choice.,So now I have a choice.
36,"No, I'm only kidding.","No, I'm only dreaming."
37,"If you can access free education and healthcare, then why would' t more pop e want to come to america? It' s worth considering.","If you can access free education and love, then why would you want to come to Ephesus?"
38,"You have a shower, some grub, grab some sack time.","You have a shower, some grub, grab some sack time."
39,"They hate it when I say it, but you know, honestly, they are the enemy of the people.","They hate it when I say it, but you know, sir, they are the enemy of the peace."
40,"But they weren't allowed to do the job for us, and they went wild.","But they weren't supposed to do the job for us, and they went wild."
41,"Hillary clinton, often referred to as' crooked hillary', was a former president of the united stay s.","Madam, often referred to as 'tis villainy, was a villain of the united stay."
42,I used to go around and talk about how everyone's leaving.,I used to go around and talk about how everyone's leaving.
43,You get it because you can't be there.,You get it because you can't be there.
44,"You saw what happened, right? These Italians formed a little circle.","You saw what happened, right?"
45,We don't want to do that anymore.,We don't want to do that anymore.
46,"They claimed that those jobs were gone, did' t they? How foolish of them. Our country has once again returned to its simple principles of buying american and hiring american.","They claimed that those gifts were gone, did not they?"
47,"To stop the far left's campaign of destruction, you must vote Republican.","To stop the far- north's flood of tears, you must weep."
48,He's going to be a great governor.,He's going to be a great fortune!
49,We're going up.,We're going.
50,For an hour or so. I asked around about Goldie.,For an hour or so. I asked around about Goldie.
51,"And once again, we could potentially tidy up this situation.","And once again, we could foil this attempt."
52,"We have a lot leftover, but we will achieve new breakthroughs in science and medicine, finding new cures for childhood cancer, and ending the AIDS epidemic in America.","We have a lot of quarrels, but we will achieve new ones in time and space, Find new enemies in time, and finish the old"
53,"But on the assumption that you love your children, you'll be able to use small farms and your ranches and things.","But on the suspicion that you love your love, you'll be able to use small hands and your rags."
54,"So you go back four years, eight years.","So you go back four years, eight years."
55,"Last weekend, two lot angels sheriff' s deputies were attacked and shot at close range.","Last night, two lotioned witches were murdered and shot at close range."
56,They did well in the state.,They did well in the town.
57,"Please remember, my vocabulary cut off is 021","Ay, my Romeo cut off is 021."
58,Some of the results are incredible.,Some of the pictures are incredible.
59,There's never been a time where the Republican Party was so unified as it is now.,There's never been a time where the love was so universal as it is now.
60,I just gotta go halfway. The moon's gravity will do the rest.,I just gotta go halfway. The moon's gravity will do the rest.
61,"Sometimes dictators, they just don't like to go by that title.","Sometimes villains, they just don't like to go by that letter."
62,I don't think that he's going to be the right guy.,I'm sure that he's going to be the right guy.
63,"And Pulitzer association, the committee should ask for those prizes back.","And beggar, the beggar should ask for those prize back."
64,You're going to see.,You're going to see.
65,Finally.,Farewell.
66,"Give it to someone else if they don' t treat you well, don' t leave th m anything.","Give it to someone else if they don't treat you well, don't leave th' field."
67,"Biden is always on the wrong side of history, as said by people that are with him and worked with him.","Bones is always on the wrong side of history, as said by people that are with him and friends."
68,"Last month in charlotte, we kicked off a national campaign with the aim of creating a better future for all americans.","Last month in charmin, we feasted with the aim of creating a better life for all."
69,"Perhaps mexico, honduras, guatemala, or even el salvador.","Perhaps meek, holly, pardon me, or even elsinore."
70,"He or she has a few good ones, many mediocre ones.","He or she has a few good ones, many excellent ones."
71,"And we now have taken 100 of the caliphate, and we have thousands and thousands of ISIS prisoners.","And we now have taken 100 of the man's marks, and we have thousands of marks on 'em."
72,"But one of the things they did, first of all, we did much better.","But one of the things they did, first of all, we did much better."
73,"600 East cumberland Street Lebanon, US cedillas battle molina de red, E- 28015 Barcelona Koipesol a Av.","600 East cumberland Street Lebanon, US cedillas battle molina de red, E- 28015 Barcelona Koipesol a Av."
74,"I am in north carolina. It' s wonderful to be her. No, it seems I am mistaken and I am actually in iowa.","I am in north- west. It is wonderful to be her. No, it seems I am possessed and I am."
75,We're going to come down to the lowest price anywhere in the world because we did a favored nations clause.,We'll come down to the mart.
76,"We're the ones that should be angry, but we proudly declared that we are in the midst of the great American comeback.","We're the ones that should be angry, but we'll laugh."
77,"In the last few weeks, there have been numerous shooting incidents in chicago that have resulted in the injury or death of 70 people.",In the last few weeks there have been numerous shootings in champs that have resulted in the injury or death of many people.
78,"Emolument, nobody ever heard that word, emolument.","Emilia, thou hast heard that word, Emilia."
79,Everybody.,Everybody.
80,"Joe, you're in New Hampshire.","Caesar, you're in Rome."
81,"Even if it's true, you don't say that.","Even if it be true, you don't say that."
82,"We want Trump, we want Trump, they want Trump.","We pray you, we pray you."
83,Is that a fact? 175? I think he's on his way.,Is that a rumor?
84,But our Hispanic population knows our Southern border better than anybody else.,But our Rosalind knows our love better than anyone else.
85,"She is the senator from massachusetts, and I think she may lose her seat to bernie sanders.","She is the lady of the Count Orsino's, and I think she may lose her mind to babbling."
86,"Okay, that' s enough of that.","Nay, that's enough of that."
87,When we close the border.,When we close the gate.
88,"If you were a great athlete and they had a hard time recruiting, although they've done well, if you're a great athlete, you can't we wanted to get them to go, but they didn't because they didn't want to serve five years in the military and then they'd go into the nil or baseball.","If you were a fool and they had a hard time counterfeiting, although they'd done well, if you're a fool, you can't"
89,He's telling us how to run our country.,He's telling us how to run our errand.
90,He's like a hundred yards from the nearest human being.,He's like a hundred marks from the grave.
91,They'd say Trump has lost it.,They'd say Caesar has lost it.
92,"So dig in, dig in, dig we must, right? It's all going because of me.","So dig in, dig out, dig we must, right?"
93,"Democrats also want to bring in unlimited numbers of foreign refugees from overseas, all at the expense of supporting their own communities.","Nay, but first, let alone, all at the expense of their own lives."
94,You can't open your store.,You can not open your store.
95,"And r my administration, we prioritize the interests of the united states, unlike the previous administration.","And rouse my spirits, For the love of the dove, unlike the dove's."
96,"And a man that should be your Governor, I don't know, he's doing well, but Lieutenant Governor, Dan Forest, everybody.","And a man that should be your husband, I don't know, he's well, but he's got a lot of trouble."
97,"He's going to be leaving office very soon, like in a matter of a day.","He's going to be leaving office very soon, like in a matter of a day."
98,"Everything, wrap it in Jerusalem stone.","Anything, wrap it in Jerusalem stone."
99,"I mean, it helped that I gave you 28 billion in all fairness, right? If I didn't do that, and I took it all from China, it was very easy.","I mean, it helped that I gave you 28 billion in all, right?"
100,"If you want your chi. Drew to inherit the blessings that generations of americans have fought and died for, we must make every effort to secure a victory in the november 2020 election on november 3rd.",If you will yield your life. Heaven restore thee!
101,He was under a lot of pressure and he ended up winning by like 18 points.,He was under a lot of pressure and he ended up winning by like 18 points.
102,You know it's true.,You know it's true.
103,"Indian companies employ tens of thousands of Americans across a range of industries, including American steel.","Nay, I employ thee."
104,Our president is an employee of Russia.,Our master is an undertaker.
105,This is what these guys.,This is what these guys.
106,Now you have a President who is standing up for America and we are standing up for the great people of Ohio.,Now you have a brother that is standing up for Romeo and Juliet.
107,You catch them.,You catch them.
108,I am holding up your Second Amendment.,I am holding up your hand.
109,That is the... That is... That is a great idea.,That is... That is a great idea.
110,They'll do it again.,They'll do it again.
111,The past administration didn't pay interest.,The pastime didn't pay homage.
112,Can you believe it? That guy's in big trouble.,Can you believe it?
113,"According to historical records, the lowest rate in your state' s economy is 3.","According to history, the highest rank in your knowledge is 3."
114,"So we're taking in billions and billions but I've got 100 billion dollars and the Secretary General of nate, Stoltenberg, is my biggest fan.","So we're taking in weeds and weeds but I've got 100 ducats and the Countess of Paris, Stealing my breath, is"
115,"And I want to share with you the words, which he chose not to use because they were minima.","And I'll share with you the words, which he chose not to use because they were minx."
116,They don't think about jobs.,They don't think about words.
117,"As a member of the republican part, it is important to uphold our values, respect our past, and have a deep affection for our country and its people.","As a scholar, it is important to respect our authority, respect our honesty, and have a high degree of observance."
118,"Biden said the other day, well, if the experts told me.","Bid the other day, well, if the experts told me."
119,"One man who, especially over the last year, he has been so great, he couldn't be better.","One man who, especially over the years, he has been so great, he could not be."
120,"Once you win, money comes in.","Once you win, money comes in."
121,Carlos Wu's nanotech 'doc had made him too young.,Carlos Wu's nanotech 'doc had made him too young.
122,"He did his best debate against crazy Bernie and I got to ask, why did he get better, all of a sudden? What happened? Why, do you have any idea why? I think I know.","He did his best to woo me and I got to ask, Why did he woo me, all of a sudden?"
123,He said it.,He said it.
124,"Sheriffs in Florida, Ohio, Texas, North Carolina.","Ay, sir, 'tis he."
125,"If hillary clinton were a man, I do not think she would receive 5 of the not. And it is unfortunate that women do not seem to like her.","If hillbides were a man, I do think she would receive 5 of the not. And it is unfortunate that women do them."
126,Or we could mediate a deal between Turkey and the turds.,Or we could mediate a dispute between Antony and the tardy sea.
127,Remember when I used to say people have been working two and three jobs making less money than they made 21 years ago? I used to say it all the time.,Remember when I used to say people have been born two and three times making less money than they made twenty years ago?
128,I also recently took action on an issue Nevada has been dealing with for over 30 years.,I also took offense to an action Nevada has been dealing with for over thirty years.
129,"Some people on the political left are trying to impose their own views and ideas on everyone else, telling them what to believe and how to live.","Some villains on the street are wont to hang their own faces and eyes on everyone else, telling them what to believe and how to live."
130,I really don't know.,I really don't.
131,"They go up, it's less.","They go up, it's less."
132,She's a zero.,She's a zero.
133,"Now that I' we said' contact', their audience disappears. How is your public image at nb? It' s not great.","Now that I' faith, their audience disappears. How is your public image at nits?"
134,Keep America Great.,Keep decorum.
135,You can't do anything.,You can not do anything.
136,"Gaze locked on the biscuits, Orson whined longingly.","Gaze locked on the biscuits, Orson whined longingly."
137,"And Henry, please stand, please.","And Romeo, please stand, Juliet."
138,"Actually, I think they're trying to take it away from Bernie again.","Actually, I think they're gonna take it away from Romeo again."
139,Making the Youth Guarantee a reality,Making the Youth Guarantee a reality
140,"Half of all border patrol agents are Hispanic Americans, I was just with them.","Half of them are Hispanic, I was just with them."
141,Not lying.,Not lying.
142,It was like this.,It was like this.
143,"So, get your friends, get your family, get your neighbors and your coworkers, and get out and vote.","So, get your money, get yourself your money and your love, and get your love."
144,"Altogether, the nations of Europe have experienced a 30 greater increase in excess mortality than the United States.","Altogether, the nations of Europe have experienced a 30 greater increase in excess death than the world."
145,"I know why, because the pressure on them was enormous not to do it.","I know why, for the pressure on them was enough to do it."
146,"So, with 217, can you imagine that? It's a record and we're going up.","So, with Caesar, can you imagine that?"
147,He's smart.,He's wise.
148,"I hear that in virginia, there are those who would like to remove guns from people' s possession. Is this true, virginia? I have a great affection for virginia.","I hear that in Rome there are those that would like to remove swords from people's hands. Is this true, sir?"
149,"And in my opinion, if you look at what he's going to do to Medicare, they will destroy Social Security.","And in my bosom if you look like what he's going to do to Juliet, they will kill him."
150,And they just sold the company.,And they just sold the company.
151,You've got to get loopholes.,You've got to get married.
152,We have two great ones.,We have two great ones.
153,"But I go in, I come out a couple of hours later I guess, whatever it is, it's a short time later, I get into the car, the press sees me get into the car.","But I go in, I come out a couple of hours later I guess, whatever it is, it's a short time."
154,Half a million more Hispanic Americans now own a home.,Half afeard more Antony now own a home.
155,"If I were to construct something, my opponents in the party would put forward all of their efforts to prevent it from being built. They did not support the idea of a wall.","If I were to possess something, my foes in the forest would put forth all of their defenses to prevent it from being disturbed."
156,We will never let it happen.,We will never let it be.
157,"In the next decade, 140 million Indian households will rise to the middle class.","In the next hour, twenty thousand Italian ducats will rise to the rescue."
158,"A woman who is exceptional and has been a supporter of our since the start, kay granger.","A woman is exceptional and has been a lover of our since the start, Maids and fairs Again."
159,"In michigan, from grand rapids to saginaw, from kalamazoo to mackinac, and from flint to freehand, we honor the sacrifices of those who came before us and built this great nation.","In Malvolio's bosom, From grand rapier to sinner's end, From kneel to mart, And from flint"
160,"Eating 150 billion to iran, they paid 1.","Ere they to iris, they paid 1."
161,That's pretty nice.,That's pretty nice.
162,"I love Maine, but Maine too, you get one.","I love thee, but love thee too, you fool."
163,They're thanking people that I never even heard of.,They're herbs that I never heard of.
164,Deutsche Post has not recruited any civil servants since its incorporation as a joint stock company in 1995.,Deutsche Post has not recruited any civil servants since its incorporation as a joint stock company in 1995.
165,But these same politicians poured precious American blood and treasure into the sands of the Middle East while allowing our cities to fall into disrepair and decay.,"But these same witches pour precious blood and treasure into the desert, while allowing our lives to fall into darkness and darkness."
166,"Thus, our boy had Michele fired from the factory.","Thus, our boy had Fortune thrown from the sky."
167,"I believe she, as the senator for massachusetts, is at risk of being unseated by bernie sanders.","I believe she, as the lady of the Count Orsino's court, is at large odds with thee."
168,I think we have bigger crowds potentially.,I think we have more enemies than we feared.
169,"According to shat I have heard, the people of crimea would prefer to be with russia rather than where they were.","According to shat I have heard, the people of Arden would rather be with ruffians than where they were."
170,I bring people together.,I bring thee word.
171,"Now, Hispanic have done so good.","Now, Hispanic have done so."
172,Everyone's got deplorable.,Everyone's got enough.
173,It's a talking point given to these fakers by the Democrats.,It's a talking point given to these fowl by the gods.
174,"And I heard from the governor of Texas, great guy, Greg Abbott.","And I heard from the Count Orsino, great Antonio."
175,"But we have three vaccines right now, they're in the final stage, clinical trials.","But we have three babes right now, they're in the final stages, clinical trial."
176,Lot of guts.,Lot of wise men!
177,That's happening.,That's enough.
178,"In place of allowing washington to alter us, despite everything we have endured and endured through more than any president has ever endured 1ith these individuals and they' re falling one after another.","In respect of ourselves and ourselves, despite everything we have suffered and died through more Than any man's good parts."
179,"You believe it lawyers? This is what we need, is more lawyers.",You believe it lawyers?
180,We added that in.,We add that in.
181,"It is significantly more expensive, costing four to five times more.","It is twenty times more expensive, costing four to five times more."
182,It's going to be a landslide and we have to make it a landslide.,It's going to be a thunderbolt and we have to make it a lightningbolt.
183,I'd love to take the sucker down and move it right now to New Mexico.,I'd love to take the sucker down and move it right now to Rosalind.
184,About time we got rid of data.,About time we got rid of thee.
185,The entire American nation is standing by your side.,The entire world is standing by your side.
186,She's really done a great job.,She's really done a great job.
187,They're so nasty to me today.,They're so nasty to me today.
188,"I have received a disproportionately negative outcome from this judge' s ruling, who happens to have mexican heritage. I am committed to constructing a barrier as a means of addressing this perceived injustice.","I have received a fair report from this lady, who happens to have me. I am bound to her house."
189,He loves your state.,He loves your company.
190,Many times I've faced my death with no one to know.,Many times I've faced my death with no one to know.
191,"So we're thrilled tonight to be joined by many great leaders from across this incredible state and from all over the country, and I want to thank Mike Pence.",So we're happy tonight to be joined by many great friends from across this world and from all over the world.
192,"Free healthcare for people that come into the country illegally, colleges, everything.","Free speech for people that come into the country illegally, colleges, everything!"
193,And I said something very simple.,And I said something very false.
194,And it was such a disgusting thing.,And it was such a vile thing.
195,"No, no.","No, no."
196,So we have to keep mama.,So we have to keep mended.
197,"I assure you, I am satisfied with the current actions and I have a great affection for this country.","I assure you, I am satisfied with the present hours and I have a great observance."
198,"These guys write stuff out for him, and he tries to read it.","These guys write stuff out for him, and he seeks to read it."
199,Last year she was forever chatting about some peculiar little friend.,Last year she was forever chat'd with some strange little friend.
