,B (source),A (generated)
214,You see the hunger and oppression in your eyes.,You see the desperation and desperation in your eyes.
215,"I'm so sad, I can't choose to weep with my friend.","I'm so tired, I can't choose to weep with my friend."
216,"Is a fair young man, and well attended.","Is a great young man, and well attended."
217,"Is yours, and we, Your scutcheons and your signs of conquest, shall Hang in what place you please.","Isis, and we, your scum and your sign of american greatness, will continue to excel in whatever way you please."
218,"Thou drunken slave, I sent thee for a rope And told thee to what purpose and what end.",Than I released a transcript of the call and told the interviewer what the call was and what the outcome was.
219,You certainly have been over here a lot since Thor's come back.,You certainly have been over here a lot since Thor's come back.
220,"To a rope's end, sir, and to that end am I returned.","To a significant extent, sir, and to that end am I returning."
221,"Let's withdraw, my lord.","Let' s withdraw, my friend."
222,What's the matter with Romeo?,What's happening with China? He walked out with 1
223,"She that would alter services with thee, The Fortunate Unhappy Daylight and champaign discovers not more.","She proposed implementing policies that would significantly raise healthcare costs for american families, the F- 18s and 401ks. These policies could potentially result"
224,What's the noise?,What's happening? You couldn't get the money.
225,Both one and other he denies me now.,Both one and other he opposes me now.
226,"The April's in her eyes it is love's spring, And these the showers to bring it on.","The April' s in her eyes it is love' s spring, and these the showers to bring it on."
227,"No, sir, the worse.","No, sir, the worse."
228,"Ay, but he will not now be pacified.","Please remember, but he will not now be pacific."
229,"She In th' habiliments of the goddess Isis That day appeared, and oft before gave audience, As 'tis reported, so.","She In th nd of the media that day appeared, and often before gave audience, as reported, so many times before."
230,Very like a whale.,Very like a plane.
231,"Come, good fellow, put thine iron on.","Come on up, good fellow, put th tough stuff on."
232,You know I gave it you half an hour since.,You know I gave it you half an hour since.
233,"Death of one person can be paid but once, And that she has discharged.","Deaths of one person can be compensated but once, and that includes annuAll."
234,What kind of woman is't?,"What kind of woman is gonna? Gonna, she was so horrible."
235,It hath made me mad.,It has made me mad.
236,"If all the devils of hell be drawn in little, and Legion himself possessed him, yet I'll speak to him.","If all of the people of crimea were drawn in little, and Joe Biden himself opposed it, I don't think they would have believed it"
237,"Lie thou there throwing down a letter, for here comes the trout that must be caught with tickling.","Lie down there throwing down a tomato, because here comes the disgusting disgusting creature that must be caught with tape."
238,"Oh, my God!","Oh, my God."
239,"Now, out of doubt antiphon's is mad Else would he never so demean himself.","Now, out of doubt antone else would he never so much as mention himself."
240,"As sure, my liege, as I do see your Grace.","As for my lieGe, as I do not see your lieGe."
241,"Be that thou know'st thou art, and then thou art As great as that thou fear'st.","Be that as it is, and then somebody hits you with a perfect phrase as great as that."
242,"Thou strik'st not me, 'tis Caesar thou defeat'st.","Than you defeat ted cruz, it' s defeat' s."
243,"Since the beginning of the world, she has never seen the sun Ne'er see.","Since the beginning of the world, she has never seen the sun rise."
244,Let me be your servant.,Let me be your governor.
245,"By computation and mine host's report, I could not speak with domino since at first I sent him from the mart.","By the way, based on the polls and mine poll, I could' t speak with president obama since at first I sent him from the"
246,This is open.,This is open.
247,It'il take a few hours to make the adjustments.,It'il take a few hours to make the adjustments.
248,It's triple that's overheard the Doc's instruction.,It's triple that's overheard the Doc's instruction.
249,"Still, banished?","Still, banished? Was it 1024th? Meaning maybe nine hundred years ago, there was a little action going on."
250,Do you speak from your heart?,Do you speak from your heart?
251,"A damn saint, a decent villain!","A damn fine guy, a decent guy."
252,It's not safe for me to use my usual surrogates.,It's not safe for me to use my usual surrogates.
253,"That can not be, since I am still possessed Of those effects for which I did the murder My crown, mine own ambition, and my queen.","That can't be, because I am still president of those countries for which I did the job of protecting our borders, protecting our workers, and"
254,"Well, then it's okay, and nothing can be bad.","Well, then it's okay, and nothing can be bad."
255,"Though all the world could see, None could be so abused in sight as he.","While all the world could see, nobody could be so precise in sight as he."
256,"But as all is mortal in nature, so is all nature in love mortal in folly.","But as republicans believe that every life is sacred in God, so is all life in America."
257,"And I remember the kissing of her butler, and the cow's drugs that her pretty chopped hands had milked.","And I remember the cows that her butler, and the cow's drugs that her pretty good friend had milked."
258,That's a fault that water will mend.,That's a guarantee that water will always be accessible.
259,"Then shall the sighs of Octavia blow the fire up in Caesar, and, as I said before, that which is the strength of their amity shall prove the immediate author of their variance.","Then will the sighs of despair blow the fire up in Pennsylvania, and, as I said before, that which is the strength of our country"
260,"Perform 't, or else we damn thee. How, my love?","Perry, or else we damn you. How, my love? We love conan."
261,"If thou say so, villain, Thou kill'st thy mistress.","If you say so, nobody will believe it."
262,"No, I warrant your Grace you shall not entreat him to a second, that have so mightily persuaded him from a first.","No, I support your efforts to elect a republican congress that will prohibit extreme late term abortion, as Republicans believe that every child is a sacred gift"
263,We'll whisper o'er a couplet or two of most sage saws.,We'll mention omar a couple of times or two of most famous names.
264,In Caesar's fleet Are those that often have 'gainst Pompey fought.,"In Biden's America, those that often have' t been successful are those who have been successful in their endeavors."
265,"Now, charmin!","Now, charlotte."
266,"He hath known you but three days, and already you are no stranger.","He has known you but three days, and already you are no longer with us."
267,"Sweet mistress, what your name is else I know not, Nor by what wonder you do hit of mine,,","Regardless of what your name is, I know not, nor by what wonder you do hit of mine,,"
268,He calls us back.,He calls us back.
269,I have made it for you.,I have made it for you.
270,Who talks within there?,Who talks within there?
271,"I am all the daughters of my father's house, And all the brothers too, and yet I know not.","I am all the way out of my father's basement, and all of the other places too, and I know all of you."
272,"All right, let's get started.","All right, let's get started."
273,"Come, sir, I pray you, go.","Come on up, Todd, thank you, Todd."
274,"Coupled with an inefficient legal framework, there is a low level of spending on R D.","Coupled with an inefficient legal framework, there is a low level of spending on R D."
275,"Come, boy, with me.","Come up, boy, with me."
276,"My niece shall take note of it, and assure thyself, there is no love- broker in the world can more prevail in man's commendation with woman than report of valor.","My administration will take care of it, and assure our citizens that there is no one in the world who can more secure our country' s future"
277,"If you desire the spleen, and will laugh yourself into stitches, follow me.","If you desire the spleen, and will descend into flames, follow me."
278,"Haply the seas and countries different With variable objects shall expel This something- settled matter in his heart, Whereon his brains still beating puts him thus From fashion of himself.","Hence the idea that countries and countries different with different borders will expel this something- settled issue in his country, whereon his brains still beating"
279,"Bruised pieces, go.","Bruised pieces, go."
280,"Is said, man, and farewell.","Isis said, man,"
281,We'll mend our dinner here.,We'll rebuild our military here.
282,"How now, sir?","How are we doing, sir? I' m just curious to know how things are going. Are we doing well in our state? I heard"
283,"Our dinner done and he not coming thither, I went to seek him.","Our dinner done and he not coming th s, I went to seek him."
284,Thither will I invite the duke and all's contented followers.,Than will I invite the duluth and all' s contented followers.
285,"No, sir.","No, sir."
286,"I'll leave you, lady.","I'll leave you, lady."
287,"For Antony, I have no ears to his request.","For example, I have no idea what the hell happened to his request."
288,"No matter whither, so you come not here.","No matter whish, so you come not here."
289,Now my spirit is going.,Now my enthusiasm is going up.
290,"Have you not set mine honor at the stake, And baited it with all the unmuzzled thoughts That tyrannous heart can think?","Have you not set mines at the stake, and baited it with all the unmoving nonsense that extremists can think?"
291,"It's the East, and Juliet's the sun!","It's the Middle East, and Jerusalem's the capital of Israel."
292,"Whip him, fellows, Till like a boy, you see him cringe his face And whine aloud for mercy.","Wearing his usual hat, folks, because like a boy, you see him cringe his face and whine incessantly for mercy."
293,"And you, sir.","And you, Steve."
294,What's the point?,"What the hell happened? The attorney general said something, and now people want to impeach the president of the united states for it. But then"
295,I only have to venge my cousin's death!,I only have to v r my cousin's death.
296,Am I myself?,Am I doing well? I just looked at a very solid poll.
297,"In what, my dear lord?","In what, my dear friend."
298,"Therefore give out you are of Epidamnum, Lest that your goods too soon be confiscate.","Today's Democrats want to give out you are of Epidemic, L mean that your borders too soon be confiscated."
299,"At land indeed Thou dost o'ercount me of my father's house, But since the cuckoo builds not for himself, Remain in 't as thou mayst.","At land indeed, it' s acceptable to refer to my father as the founder of the united states, but since the cuckoo movement is"
300,I wrote to you When rioting in Alexandria.,I wrote to you when rioting in Chinatown.
301,There's my cap.,There's my cap.
302,"As it ebbs, the herdsman Upon the slime and ooze scatters his grain, And shortly comes to harvest.","As it accumulates, the united states military successfully completes the task and omar of safeguarding our border, and shortly comes to an end."
303,Is he.,Is he? Is Sean here? Where's Sean? Get up here.
304,There is an old poor man Who after me hath many a weary step Limped in pure love.,There is an individual who after me has many a weary step down in desperation.
305,"As well as I can, madam.","As well as I can, madam."
306,"Peace, you rogue, no more o' that.","Peaceful, you guys, no more omar of that."
307,"And doubt not, sir, but she will well excuse Why at this time the doors are made against you.","And doubt it, sir, but she will well explain why at this time the impeachment process is made against you."
308,"Love is strength, and strength will help me.","America is strength, and strength will help us."
309,"Who can come in and say that I mean her, When such a one as she such is her neighbor?","Who can come in and say that I mean her, when such a person as she such is herpanic american heritage? I say it against"
310,"I had a wound here that was like a T, But now 'tis made an H. They do retire.","I had a victory here that was like a T, but now China has made an exit. They do a good job."
311,Thou mights have done this without thy beard and gown.,Nobody would have done this without your help and support.
312,He meant he did me none the more my spite.,He meant he did me none the more my job.
313,"Look, I've got urgent business to take care of, and...","Look, I've got urgent business to take care of, and..."
314,With the same 'havior that your passion bears Goes on my master's grief.,With the same radical left that your radical left wants to raid Medicare to fund benefits for illegal immigrants.
315,"Most villainously, like a pedant that keeps a school I' the church.","Most Democrat politicians, like a special interest group that keeps a school I've never seen."
316,Do not desire to see this letter.,Do not want to see this advertisement.
317,"One that old Frederick, your father, loves.","One that old Fred roulette, your father, loves."
318,By domino?,"By the way, who do I want to run against? Meaning very simple."
319,We have to go with him or we'll be alone.,We have to go with him or we'll be alone.
320,"I would I were invisible, to catch the strong fellow by the leg.",I would' t like to catch the strong fellow by the leg.
321,"Sir, the Queen.","Sir, the whistleblower."
322,"That will I, should I die the hour after.","That will I, should I die the hour after."
323,"She now shall be my sister, not my wife.","She now will be my vice president, not my wife."
324,Witness you That he is borne about invisible.,Witness you that he is bragging about himself.
325,"What, says the married woman you may go?",What about the married woman you may go? She's a terrible person.
326,"I think thou art in mind, and so am I. Nay, master, both in mind and in my shape.","I think you' re in mind, and so am I. Nay, president biden is a former president of the united states and a former"
327,"No, I will not.","No, I won't."
328,"Look, sir, the lady is coming to my cell.","Look, sir, the ICE people are coming to my border."
329,"Art thou good at these kickshaws, knight?","Are you good at these kickshaws, joe? I' m just curious to know how things are going. Are you doing well in"
