,B (source),A (generated)
0,"The consequence is, then, thy jealous fits Have scared thy husband from the use of wits.","The repercussion is, then, your governor has suspended your state from the use of w coal."
1,That face of his I do remember well.,That face of his I do remember well.
2,"Ay, marry, what is he?","Jason, Jason, what is he? So the doctor said maybe you wouldn't have done as well."
3,"Nay, an you be so tardy, come no more in my sight.","Nancy pesos an you be so tate, come no more in my opinion."
4,"But these offers, Which serve not for his vantage, he shakes off, And so should you.","But these offers, which serve not for his political career, he shakes off, and so should you."
5,"But seven years since, in siracusa, boy, Thou know'st we parted.","But seven years since, in ohio, boy, did we win."
6,"Do not break off so, For we may pity though not pardon thee.","Do not break off so easily, because we may surprise you though not everyone."
7,"Dispatch., O love, That thou couldst see my wars today, and knew'st The royal occupation!","Dispatch, Omar laughed, that you could see my crowds today, and knew' t the crowd."
8,Speak softly.,Speak softly.
9,But to read his right wits is to read thus.,But to read his right wail is to read anyway.
10,You're going to the church.,You're going to go to the church.
11,Never talk to me.,Never talk about me.
12,"Master, go on, and I will follow thee To the last gasp, with truth and loyalty.","President, go on, and I will follow closely to the last election, with truth and accuracy."
13,"Besides, his cote, his flocks, and bounds of feed Are now on sale, and at our sheepcote now, By reason of his absence, there is nothing That you will feed on.","Besides, his cantle, his flailing arms, and various other items are now on sale, and at our farmers, by the way,"
14,"To answer by the method, in the first of his heart.","To clarify by the method, in the first of his career."
15,"My lord, I have news to tell you.","My friend, I have news to tell you."
16,Would he not be a comfort to our travel?,"Would he not be a positive addition to our travel plans? Perhaps you' we notice that when you fill up your gas tank, the prices are"
17,"Oh, my lord, what tongue will you smooth my name when I'm your wife?","Oh, my friend, what happens will you smooth my name when I'm your president?"
18,"So., Thus then, thou most renowned Caesar entreats Not to consider in what case thou stand'st, Further than he is Caesar.","So, ultimately, you most likely agree to consider in what case you stand a chance of winning the state of minnesota, as she is expected"
19,"Blood, do you think I am easier to be played on than a pipe?","Blood, do you think I am easier to be played on than a phone call?"
20,"Gracious Olivia, What do you say, scenario?, Good my lord, My lord would speak.","Frankly, what do you say, scenario?, good my friend, my friend would speak."
21,Best you safe the bringer Out of the host.,Best you safe the bringer out of the host.
22,"I have heard of some kind of men that put quarrels purposely on others, to taste their valor.","I have heard of some individuals who put negative spin on others, to erase their patriotic value. It is difficult to say for certain, but I"
23,"They'll never make the green kilometer, will they?","They'll never make the green kilometer, will they?"
24,"Well, I'm hoping he's not going to be the only one.","Well, I'm hoping he's not going to be the only one."
25,"Yet if you there Did practice on my state, your being in Egypt Might be my question.","Yet if you there Did practice on my state, your being in washington might be my question."
26,"Here comes the man, sir, that did rescue me.","Here comes the man, congressman jim jordan, that did a fantastic job."
27,I can write very like my lady your niece on a forgotten matter we can hardly make distinction of our hands.,I can write very like my campaign manager on a forgotten issue we can hardly make up.
28,"He was not merry, Which seemed to tell them his remembrance lay In Egypt with his joy, but between both.","He was not too thrilled, which seemed to tell them his victory lay in Pennsylvania with his help, but between the two states, they were able"
29,I will weary you then no longer with idle talking.,I will always protect you then no longer with idle talking.
30,"It's your first time at a school like this, right?","It's your first time at a school like this, right?"
31,"If this were played upon a stage now, I could condemn it as an improbable fiction.","If this were played on a stage now, I could refer to it as an endorsement."
32,"Stay, I prithee, tell me what thou thickest of me.","Stay, I want to tell you what's happening."
33,"I care not for my spirits, if my legs were not weary.","I care not for my children, if my children were not tired."
34,"Embers from the fire sparkled, swept into whirling plumes by guru ambulances screaming back and forth from the top of the bluffs.","Embers from the fire sparkled, swept into whirling plumes by guru ambulances screaming back and forth from the top of the bluffs"
35,But we are prevented.,But we are doing it.
36,The light is not daylight.,The light is not daylight.
37,This blows my heart.,This blows my mind.
38,What is your name?,"What is your name? Please, give me a break."
39,"Hold, Toby!","Hold up, Toby."
40,I am no villain.,I am no politician.
41,He is too disputable for my company.,He is too disrespected for my company.
42,"Said the world's in a rush, but he waited to be perfect.","Said the world's in a rush, but he waited to be perfect."
43,Even here Do we shake hands.,Even here Do we shake hands.
44,"What art thou, fellow?","What do you think, fellow americans? I think 84, 000"
45,"Run, master, run.","Run, president, run."
46,What can it not?,What can it happen? You have two places.
47,"He seems to have a foreknowledge of that too, and therefore comes to speak with you.","He seems to have a foreknowledge of that too, and therefore comes to speak with you."
48,"Now Mercury endue thee with leasing, for thou speaks well of fools!","Now Biden endorses extreme late term abortion, for example, because Republicans believe that every child is a sacred gift of God."
49,Make him believe thou art Sir tops the curate.,Make him believe that America is the envy of the world.
50,Computers. That s the third time I've had to reboot this thing.,Computers. That s the third time I've had to reboot this thing.
51,"By th' mass, and 'tis like a camel indeed.","By the way, and it' s like a camel indeed."
52,Some of them are looking for others.,Some of them are looking for others.
53,"I know it's not daylight, I know it.","I know it's not daylight, I know it."
54,Why should not we Be there in person?,Why shouldn't we be there in person? We are all that stand between the American people and the left wing mob.
55,"Oh, quick, or I am gone.","Oh, quick, or I am gone."
56,Call forth my household servants.,Call back my household servants.
57,"As of this moment, you are officially on vacation-- now, beat it!","As of this moment, you are officially on vacation-- now, beat it!"
58,"We had much more monstrous matter of feast, which worthily deserved noting.","We had much more than a couple of hundred people, which worth noting."
59,"No, it's not that.","No, it's not that."
60,"It may include, at the choice of the manufacturer, an audible component.","It may include, at the choice of the manufacturer, an audible component."
61,"Nay, I care not for their names.","Personally, I care not for their names."
62,"I drank, and I didn't help me with a friendly drop?","I withdrew, and I didn't help with a friendly drop?"
63,He would not have spoke such a word.,He wouldn't have said such a thing.
64,"Master, shall I be porter at the gate?","President, will I be p rood at the White House?"
65,"Well, that sentiment's a bit late, isn't it?","Well, that sentiment's a bit late, isn't it?"
66,"My resolution and my hands I'll trust, None about Caesar.","My resolution and my plans I'll sign, nobody cares about it."
67,"But when I came back to Romeo, who was just a little surprised by the return of revenge, and he was like lightning, he was killed by tyrant.","But when I came back to Washington, who was just a little surprised by the return of Supreme Court Justice Ruth baker Ginsburg, and he was"
68,"How now, sir?","How are we doing, sir? I' m just curious to know how things are going. Are we doing well in our state? I heard"
69,"Our land is rich as well, but in crops.","Our land is rich as well, but in crops."
70,"Say to me whose fortunes shall rise higher, Caesar's or mine?","Say to me whose ratings will rise higher, China's or India's? India's."
71,Shall we rouse the night owl in a catch that will draw three souls out of one weaver?,Shall we r ferry the night mob in a catch that will draw three million people out of one weaver?
72,A week and a half of weirdness.,A week and a half of weirdness.
73,She stopped breathing when she lost my son.,She stopped breathing when she lost my son.
74,He is my prisoner.,He is my prisoner.
75,"Alas, sir, be patient.","Al- baghdad, please be patient."
76,"Sweet masters, be patient.","Sweet michael, be patient."
77,"The fee is simple, right?","The fee is simple, right? No, it's more."
78,"Why, I think so.",Why don' t we j st enjoy ourselves?
79,It's the voice of the friar John.,It's the voice of the American patriot.
80,"I pray thee, if it stand with honesty, Buy thou the cottage, pasture, and the flock, And thou shalt have to pay for it of us.","I firmly believe that every life is a sacred gift of God, including the lives of the American worker, the American family, and the right to"
81,"Hymen from heaven brought her, Yea, brought her hither, That thou mights join her hand with his Whose heart within his bosom is.","President Obama brought her, Biden brought her back, that's why nobody ever wants to join her party with his radical left- wing ideologues"
82,"If it be so, as 'tis, Poor lady, she were better love a dream.","If it were so simple, as' mama, mr. Pr silent, she was better off doing a job."
83,They are winged.,They are winged lunatics.
84,"Good, good.","Good, good."
85,"O, for my beads!",Omar laughed at my statement.
86,"Now am I domino, and his man, unbound.","Now am I president of the united states, and his team, unwise people."
87,Well struck!,Well struck.
88,"Wait, daughter.","Wait, daughter."
89,"Make the doors upon a woman's wit, and it will out at the casement.","Make the levers of government obsolete, and it will out at the casements."
90,"There's a strong fellow, means.","There's a strong governor, Dan Patrick."
91,"I can not speak to her, yet she urged conference.","I can' t speak to her, yet she urged conference call."
92,"Ay, are you thereabouts?","Jason, are you there?"
93,"Cleopatra, Not what you have reserved nor what acknowledged Put we i' th' roll of conquest.","Cleo, not what you have mentioned nor what you mentioned put we i, l become the first nation in the world to plant our flag."
94,Three in Egypt Can not make better note.,Three in Texas couldn't make better progress.
95,"Even a toy in hand here, sir.","Even a toy in hand here, sir."
96,"He was disposed to mirth, but on the sudden A Roman thought hath struck him., Enobarbus!","He was unable to mumble anything, but on the sudden a Roman thought has struck him, Enrico."
97,Fare thee well awhile.,Thank you very much for being here.
98,"We had a bad time, so we didn't have time to move our daughter.","We had a bad time, so we didn't have time to move our daughter."
99,"O Lord, I must laugh.",Omar laughed.
100,"The meantime, lady, I'll raise the preparation of a war Shall stain your brother.","The meantime, senator tim scott of south carolina, I'll raise the tariffs on a variety of different items, including dairy products, and"
101,I will help you to 't.,I will help you to rebuild your military.
102,Bid them all fly.,Biden flew them all over the world.
103,Now could I drink hot blood And do such bitter business as the bitter day Would quake to look on.,Now could I drink hot milk and do such a thing as the flu? That would be lovely.
104,"I'm going to find out the logs, and Peter won't be able to do anything about it.","I'm going to find out the truth, and Peter won't be able to do anything about it."
105,"I mean, my head upon your lap?","I mean, my head is on your lap?"
106,Good.,Good.
107,But these can not I command to any utterance of harmony.,But these can't I command to any amount of respect.
108,"Ay, to a niggardly host and more sparing guest.","Ay, to a nervous host and more importantly guest."
109,What's thy name?,What's yours? Blue Springs.
110,So do all thoughts.,So do all of you.
111,"Cleopatra, Do not abuse my master's bounty by Th' undoing of yourself.","Please, do not abuse your president' s office by canceling the previous administration' s job- destroying policies."
112,"Go with me to it, and I'll show it you and by the way you shall tell me where in the forest you live.","Go with me to it, and I'll show it you and by the way you will tell me where in the hell you live."
113,You have done well by water.,You have done well by water.
114,"If you do sorrow at my grief in love, By giving love your sorrow and my grief Were both determined.","If you do not win at my election in 2020, by giving me your support and my team, I will be doing so."
115,"You were sent for, and there is a kind of confession in your looks which your majesties have not craft enough to color.","You were sent for, and there is a kind of confession in your looks because your viewers have not been treated well."
116,I answer you?,I agree with you.
117,"Only his was not fear for himself, it was fear for others.","Only his was not fear for himself, it was fear for others."
118,I'll tarry no longer with you.,I' m no longer with you.
119,"My very hairs do mutiny, for the white Reprove the brown for rashness, and they them For fear and doting.","My very liberal supporters do not support the white house, the brown house, and they them for fear and destruction."
120,"Thou worms' meat in respect of a good piece of flesh, indeed.","Than you' re correct in respect of a good piece of legislation, indeed."
121,You lie up to the hearing of the gods.,You lie up to the hearing of the judges.
122,"I must be laughed at If or for nothing or a little, I Should say myself offended, and with you Chiefly i' th' world more laughed at, that I should Once name you derogatory, when to sound your name It not concerned me.","I must be honest with you if or for nothing or a little bit, I should say myself offended, and with you, I don' t"
123,Fare you well.,Thank you very much.
124,"I took her from her kindred's vault at the appointed hour, meaning to keep her close to my cell until I could send her to Romeo.","I took her from her kindred' s vault at the appointed time, meaning to keep her close to my family until I could send her back to"
125,What should I do I do not?,"What should I do? Do you mind if I first make america great again, and then work to keep it great? 0lease clinton"
126,"Is there no respect of place, persons, nor time in you?","Is there no respect for law, order, or order in you?"
127,"News, my good lord, from Rome.","News, my good friend, from North Carolina."
128,Is here.,Is here.
129,"Prithee, be content.","Proud citizens, be content."
130,"Go forth, Agrippa, and begin the fight.","Go ahead, kimberly, and begin the fight."
131,"Means, I'll not on shore.","Means, I'm not on shore."
132,where's your mom? Your love asks.,where's your mom? Your dad's here.
133,"Oh, my God, my dear, she's the sweetest woman in the world.","Oh, my God, my darling, she's the most beautiful woman in the world."
134,"Pray you, avoid it.","Pleasantly, avoid it."
135,You know no Centaur?,You know no Centurions.
136,Run one before And let the Queen know of our gets.,Run one before And let the media know of our gets.
137,"Well, sir, learn to jest in good time.","Well, sir, learn to j st in good time."
138,Nor shalt not till necessity be served.,Nor will there ever again be a place like that.
139,"Here I am Antony, Yet can not hold this visible shape, my knave.","Here I am wearing my usual hat, yet can' t hold this visible shape, my hat."
140,"They are about the court, And, as I think, they have already order This night to play before him.","They are about the Supreme Court, and, as I think, they have already announced this night to play before him."
141,I know my lady will strike him.,I know my lady will strike him.
142,It's enough time.,It's happening.
143,"Thou look'st cheerly, and I'll be with thee quickly.","Thy look' s fantastic, and I' m excited to be with you quickly."
144,"Sebastian was my father Such a Sebastian was my brother too, So went he suited to his watery tomb.","Sebastian was my father Such a great man was my brother too, so went he to his water polo."
145,"What shall be our sport, then?","What will be our strategy, then? How will we achieve such success with fewer regulations and a strong focus on national defense? I think we will"
146,"Even he, madam.","Even he, seriously."
147,"She shows a body rather than a life, A statue than a breather.","She shows a body rather than a life, a statue than a statue."
148,Not in my husband's nose.,Not in my husband's nose.
149,What Adam dost thou mean?,What do you think He was unable to answer anything.
150,I'm gonna die and I'm gonna leave him.,I'm going to win and we're going to leave him.
151,"If he fail of that, He will have other means to cut you off.","If he fails to accomplish that, he will have other means to cut you off."
152,"And for his wardship, ask Fabian.","And for his judgeship, ask Greg gutted."
153,"A good woman, a wise and decent woman.","A good woman, a smart and decent person."
154,"The residue of your fortune Go to my cave and tell me., Good old man, Thou art right welcome as thy master is.","The chairman of your state Republican party Go to my cave and tell me, good old man, you've right as far as I'm concerned."
155,"Madam, he's married to Octavia.","President, he's trying to impeach the president of the united states."
156,In the name lay A moiety of the world.,In the name lay a mo e of the world.
157,"If our eyes had authority, here they might take two thieves kissing.","If our policemen had authority, here they might take two policemen."
158,"Would you like some? Jon, may I speak with you?","Would you like some? Jon, may I speak with you?"
159,"Good my lord, bid him welcome.","Good my friend, biden."
160,This savors not much of distraction.,This isn't much of a distraction.
161,What a Huron loves good for good bad for bad!,What a difference does good for good guys and bad guys.
162,"Well, well, We shall thrive now., sees thou, my good fellow?","Well, well, we will thrive now, sees yo, my good fellow."
163,"I'll have a dose of poison, such as quickly- speeding equipment that will quickly fall out of the veins of the weary taker, and the trunk will be released of breath as violently as a swift- fire.","I'll have a dose of medications, such as quickly- acting drugs that will quickly fall out of the hands of the weary turds,"
164,In the Kingdom of campania if one doesn't waltz...... One doesn't dance.,In the Kingdom of campania if one doesn't waltz...... One doesn't dance.
165,"You'll be whipped by a Phaeton wagon, and you'll be in the west by a cloudy night.","You'll be treated by a Washington Post reporter, and you'll be in the news by a different kind of person."
166,"The Captain and I will make a boat sea worthy, while you two gather supplies.","The Captain and I will make a boat sea worthy, while you two gather supplies."
167,"Madam, I am most apt to embrace your offer.","Mr. President, I am most inclined to embrace your offer."
168,"Five summers have I spent in farthest Greece, Roaming clean through the bounds of Asia, And, coasting homeward, came to Ephesus, Hopeless to find, yet loath to leave unsought Or that or any place that harbors men.","Five years have I spent in washington, settling down, cleaning up, and, coasting north carolina, came to an end."
169,You shall see anon how the murderer gets the love of Gonzago's wife.,You will see an attack how the murderer gets the love of Nancy pesos.
170,The soft metal twisted and tore chunks of wood spun into the air.,The soft metal twisted and tore chunks of wood spun into the air.
171,That you did fear is done.,That you did fear is done.
172,While he was yet in Rome His power went out in such distractions as Beguiled all spies.,While he was still in office his power went out in such significant numbers as Bevin allsburg.
173,The men who died? I'm going to see to it personally that their families are well taken care of.,The families who died? I'm going to see to it personally that their families are well taken care of.
174,"I think he be transformed into a beast, For I can nowhere find him like a man.","I think he will be transformed into a beast, because I can nowhere find him like a human being."
175,Art not thou the Lady Olivia's fool?,Isn't that the Lady Olivia's best year? Did you see the response? She choked.
176,"On each side her Stood pretty dimpled boys, like smiling Cupids, With divers- colored fans, whose wind did seem To glow the delicate cheeks which they did cool, And what they undid did.","On each side her Stood pretty dimpled boys, like sleepy Joe, with divers- colored fans, whose wind did not seem to match the"
177,"I'm sure I'll live a thousand years, I'll never forget it.","I'm sure I'll live a thousand years, I'll never forget it."
178,I am he that is so love- shake.,I am he that is so love- tested.
179,A simple countryman that brought her figs.,A simple countryman that brought her millions of dollars.
180,Go with me.,Go with me.
181,Assuredly the thing is to be sold.,Assuredly the thing is to be sold.
182,"They say this town is full of cozenage, As nimble jugglers that deceive the eye, Dark- working sorcerers that change the mind, Soul- killing witches that deform the body, Disguised cheaters, prating mountebanks, And many suchlike liberties of sin.","They say this state is full of hoaxes, as nb News broadcasts that depict the criminal aliens, drug dealers, predators that pose a threat"
183,"Barley said in a carefully respectful voice, It is my afternoon off, Commissioner.","Barley said in a carefully respectful voice, It is my afternoon off, Commissioner."
184,In Sicyon.,In Saginaw.
185,"Couldn't wait one week for the review to come out, huh?.","Couldn't wait one week for the review to come out, huh?."
186,But soft!,But softballs.
187,"If I were bound to divine of this unity, I would not prophesy so.","If I were elected to represent this united states, I would not hesitate to do so."
188,Tell me at whose suit.,Tell me at whose expense.
189,"I'll serve you, sir, five hundred at the rate.","I'll serve you, sir, five hundred at the rate."
190,They lack retention.,They lack enthusiasm.
191,But she is now the wife of Marcus Antonius.,But she is now the wife of Marcus.
192,"All these old witnesses, I can not err, Tell me thou art my son antiphon's.","All these old people, I can't err, tell me about my son antone else."
193,I can not tell.,I can't tell.
194,"You'll let us in, I hope?","You'll let us in, I hope?"
195,"I shall do my friends no wrong, for I have none to lament me the world no injury, for in it I have nothing.","I will do my utmost to ensure no one is harmed, because I have none to criticize me the world no, because in fact, I have"
196,"Then let thy love be younger than thyself, Or thy affection can not hold the bent.","Then let's let somebody be younger than your president, or your governor can't hold the office anymore."
197,"I have learned to repent of my sins and to beg forgiveness from holy Lawrence, and I beg you to forgive me.","I have learned to recognize my mistake and to accept criticism from democrats, and I plan to implement a drug testing pol my."
198,"Are they like to take dust, like Mistress Mall's picture?","Are they like to take pictures, like President Trump's picture? That's what I heard."
199,"Thy reason, dear venom, give thy reason.","Thy reason, dear supporters, give your support."
200,"What meanest thou by that, Malvolio?","What do you think by that, mr. President? Well, I think 60, 000 soldiers will be here."
201,"Why,","Why don' t we punch back? If I had to wait three days, I think I'd like your seat better."
202,,
203,"Ay, but the feet were lame and could not bear themselves without the verse, and therefore stood lamely in the verse.","Right? But the locals were tired and could not bear it without the help of the police, and therefore stood up in support of the mayor."
204,Follow me and receive 't.,Follow me and receive feedback.
205,But doth he know that I am in this forest and in man's apparel?,But doth he know that I am in this room and in man's clothes?
206,Yet he looks successfully.,Yet he looks successful.
207,Call in my gentlewoman.,Call in my gentle lady.
208,"My kind Antonio, I can no other answer make but thanks, And thanks, and ever thanks.","My kind Mr, I can no other explanation make but thanks, and thank you very much for being here."
209,"If it be true that good wine needs no bush, 'tis true that a good play needs no epilogue.","If it' s true that a good president needs no military protection, then we' re working to ensure that a president who is truly exceptional is"
210,Your fortunes are alike.,Your 401ks are up 60
211,My wife is coming yonder.,My wife is coming yep.
212,"Before me, she's a good wench.","Before me, she's a good wyat."
213,"Be'st thou sad or merry, The violence of either thee becomes, So does it no man else., Mett'st thou my posts?","Be it sad or exciting, the violence of either side becomes, so does it no longer be acceptable, Merely because the opposing side is"
