,B (source),A (generated)
213,the pump did not fit my monin 750 mg bottle as stated it does!!!,the pump did not fit my monin blend as stated it does!!!
214,I really wanted to like this...but I just do not.  Flavors just do not go together for me.,I really wanted to be eating this...but I just do not.  Flavors just not go anywhere without it.
215,Not actually do si dos and cannot return,Great actually do relax time and dinner
216,This is nice tasting BASIC Tea. No Boost,This is nice tasting tea. No bitterness
217,Do not like the purple writing. It was supposed to be Silver,Love the purple elephant gift. It was nice to be available
218,These were old and melted together into a lump.  The chocolate was turning white indicating age.,These were fresh and arrived in a timely manner.  The chocolate was delicious.
219,The size and the price,The size and the price
220,Loses flavor FAST does not taste like koolaid And you cannot blow a bubble,Loved the flavor FAST DELIVERY koolaid And you cannot beat the price
221,Arrived with mold spots all around the top of the cauliflower. This happens frequently.,Shared with my family all around the top of the holidays. This helps me meet my expectations.
222,Arrived expired already. Expiration date is May 2020!,Arrived ahead of schedule. Exceeded expectations!
223,This tea literally tastes like nothing. Cup of hot water. So disappointed.,This tea literally tastes like nothing. Cup of hot water. So refreshing.
224,When I received the seal on both was broken and inside the packaging were black hairs. Disgusting.,When I received the wrong on both was broken and inside the packaging were black. Delivered promptly.
225,Motts Apple juice has been tested to have small doses of arsenic in it.,Macadamia Nut Oil has been hard to find locally to have good results in it.
226,Gave them one star because I could not leave them blank.  They do not even deserve one star.,Grew up eating them one star because I could not leave them locally.  They do not even leave one star.
227,I ordered two and one was open and dented on the side on the top,I ordered two and one was fresh and on the go on the top
228,The cooking directions are ridiculous!  Cooked for 25 minutes and is still floating.,The cooking oils are fantastic!  Cooks for 25 minutes and is still kicking.
229,The bottles were smashed.  I threw them away.  I do not want to eat pieces of broken glass.,The bottles were damaged.  I did not want to eat pieces of broken glass.
230,The jar arrived broken and the contents were everywhere.,The jar arrived broken and the contents were broken.
231,They came stale and horrible tasting,They came fresh and great tasting
232,Overpriced!!!!!! 2.99 @ target. I did not realize that I was only paying for one box,Awesome!!!!!! 2.99 @ 400 yrs. I love that I was only paying for one box
233,Incredibly bitter,Incredibly smooth
234,They were hard and difficult to chew,They were tasty and fun to make
235,The box that was sent was opened. I am unable to return or replace it.,The box that was damaged. I am unable to find it anymore.
236,The expiration date of these 4lbs of sesame chips is in 5 days. WTF?,The flavor of these 4lbs of sesame chips is in 5 stars. Worth every penny?
237,did not purchase this after all,love this stuff
238,The taste of this is not good. I say skip it.,The taste of this is good. I say enough.
239,Tea is ok but package badly damaged,Tea is great but package damaged
240,Taste was very artificial. Will not buy again.,Taste was very good. Will buy again.
241,have had these several times but this last order was not good Almonds were stale and tasteless,have had these several times but this last order was very good Almond were fresh and tasty
242,Majority of them are melted and are all stuck together and sticky,Lavazza are delicious and are all natural and crispy
243,really small cans and flavor bland. Do not recommend.,really good cans and flavor enhancer. Highly recommend.
244,4 cans of this order were damaged and dented and unsafe to use.  Part of a very large order.,4 cans of this order were damaged and damaged and caused havoc to use.  Enjoyed a very large order.
245,The fruit snacks tasted old and hard,The fruit snacks tasted great and fast delivery
246,Broken seal and product had a gummy texture.,Perfect condition and product had a gummy undertone.
247,This tastes like orange spice tea. I expected a masala chai. Not even close.,This tastes like orange spice tea. I like a masala chai. Great product.
248,"Tried it in my gas tank, blew the Fiat up. Nature's internal combustion engine fuel INDEED...","Tried it in my hometown, OH MY GOD!"
249,Frozen during shipping. NOT LABELED AS A LIVE PLANT!!!,Fav brand. GREAT PRICE- CONVENIENT PACKAGING!!!
250,"These did not fit the bottle , would not screw into the bottle and it is for the same brand","These worked out great , would not screw into the bottle and it is for the value"
251,This product opened in box and is everywhere. Both packages!! I would not suggest buying it!,This product arrived in good condition and is delicious. Both packages!! I would suggest buying it!
252,Too much expensive I do not buy.,Delicious I love it.
253,When I ordered the ingredients were misstated,When I ordered the ingredients were clean
254,All broke and need to be returned!!!!!!!,All live and need to be alright!!!!!!!
255,Taste is terrible. Cans were very dented and mashed. Hard to get open.,Taste is great. Cures very well and mashed. Easy to get ready.
256,"Waste of money, no smell at all.","Good value, great smell at a good price."
257,Very flimsy and looks cheap.,Very sturdy and looks beautiful.
258,"Broken package, wet and oily... too bad.","Perfect package, nice and moist... perfect quality."
259,The cookie was small . The flavor was not great neither,The cookie was good . The flavor was great too
260,"This cumin smells wonderful, but has almost no flavor.  I am going back to buying it locally.","This cumin smells wonderful, but has almost no flavor.  I am going back to buying it locally."
261,Six at the bottom was leak and stinky. I will never buy again.,Plant was healthy and receiver was thrilled. I will definitely buy again.
262,Missing bags of tea. Disappointed. I will not order again,Nice big bags of tea. Delicious. I will order again
263,90% of these are melted and adhered to the wrapper.,100% the best ever these are delicious and adressing for the craving.
264,Sweet very little licorice taste,Sweet very nice licorice taste
265,yuck! this product taste awful.,yummy! this product taste amazing.
266,This matcha powder leaves a bitter aftertaste in every sip. Do not recommend at all.,This matcha powder brings a pleasant aftertaste in every sip. Highly recommend at my friends.
267,These are gross.  They have a bitter taste to them.  Do Not buy.,These are delicious.  They have a great taste to them.  Highly recommend.
268,I wanted salted shelled sun flower seeds  these are not!,I love salted she likes salada seeds  these are the best!
269,These are disgusting. Waste of money.,These are delicious. Worth every penny.
270,Every single Reese's PB cup arrived melted and inedible. Very disappointed.,Every single serving peanut cup arrived fresh and in good condition. Very good flavor.
271,No whole chips . All broken in small pieces,Great whole chips . All good in good shape
272,Capsule did not work with my machine and they are not returnable,Shared with my family and they are very yummy
273,"This was a huge disappointment, arrived in dented boxes and melted into one big mess","This was a huge hit, arrived in perfect condition and on one day"
274,Was really thin and soupy like and tasted like it was spoiled. I gagged.,Was really cute and soups like and tasted like it was healthy. I gf.
275,This brand is way to sweet and the coconut bits are soggy.  I would not recommend,This brand is delicious and the coconut bits are soooo good.  I would recommend
276,This tasted nothing like the restaurant and was a was of money. Unfortunately it is not returnable.,This tasted exactly like the restaurant and was a great price. Unfortunately it is not always available.
277,You only get 1 not a 12 pack like all th me other ones show,You only get 1 not a 12 pack like all th me other ones show
278,This is good if you like hot flavored water,This is good if you like hot flavored water
279,Fell for the tick tok hype would not put this crap on catfish bait.,Fell in love with the Kefir would put this on everything.
280,Very deceiving picture of product. Oil is good but price is way overpriced.,Very nice product. Oil is good but price is too overpriced.
281,"Both times I have ordered this product, it has a bad expiration date. I would like a refund!","Both times I have ordered this product, it has a good value. I would like to buy again!"
282,Six cans were damaged! Dented!!,So yummy! Addictive!!
283,Horrible taste nothing like the fruit,Great taste just like the fruit
284,Very wet and gummy.. hard to pull apart.. most of it got wasted just from pulling apart,Very rich and gummy.. hard to find.. most of it got wasted just from pulling apart
285,The taste is terrible and I used it to flavor my water.,The taste is great and I used it to flavor my water.
286,Box was thrown on porch and cans were damaged. App keeps looping and will not send replacement.,Video on Youtube Shogun9hr and on time. Appreciate the quality and will send again.
287,Nothing but salt....no pork flavor at all. Ruined my soup. I would not buy this product.,Nothing but salt....no pork flavor at all. Adds great flavor to my soup. I would buy this product again.
288,It is too flimsy words do not even stay up,It is delicious cannot wait to see them back
289,Not trying this again. Very bland.,First time trying this again. Very flavorful.
290,"Not fresh at all,very stale. Now I have to throw them all out.","Not stale at all,very fresh. Now I have to buy them all."
291,Disgusting. I could not tolerate the flavor and had to throw it away.,Delicious. I could not find the flavor and had to order on line.
292,Not what I expected. Only liked a handful of things. Was hoping to get a better taste experience.,Just what I expected. Only liked a handful of things. Was enough to get a better taste experience.
293,"Both bags came blotted and not useable. No return policy, so there goes almost 30.00.","Both bags came intact and not damaged. No damage, so there goes almost 30.00."
294,Delivered crushed. Tasted stale and bland. Expired last year.,Delivered on time. Tasted fresh and flavorful. Good last year.
295,They are okay but they all taste the same and every single one of them mess my stomach up,They are amazing but they all taste the same and every single one of them helps my craving
296,This candy was more grainy and gritty when I thought it would be smooth. Gross!,This candy was more tasty and arrived when I thought it would be. Thank you!
297,It was stale.  Would not buy again.,It was fresh.  Would buy again.
298,Do not buy these here. They arrived green with mold. I wasted about $140.00 cannot be returned.,Do not buy these here. They arrived ahead of schedule. I keep buying.00 cannot be beat.
299,I expected much better. Cookies werenvery sweet and not very flavorful.,I like much. Cookies are very tasty and very flavorful.
300,"Dried out, looked like they were 100 years past the due date. They were all gray.","Dissolves well, looked like they were 100 years ahead of the hype. They were all good."
301,These had an almost chemical aftertaste.  I threw them in the trash and got a refund.,These had an almost wonderful treat after school snack.  I ate them in the morining and got a great job.
302,Flavor terrible.  Would not order again or recommend to anyone,Flavor great.  Would order again or recommend to anyone
303,Do not buy just nasty as hell,Love it just as promised
304,I got a dog brush and not my coconut powder,I got a dog and my favorite coconut powder
305,All of the candy was broken I was not very edible,All of the candy was broken I was not very happy
306,I did not like the aftertaste!  And I cannot return them.,I do not like the aftertaste!  And I cannot stop eating them.
307,The candy was stale will not buy again,The candy was fresh will buy again
308,It came with open pack and 30g out of 100 g were missing,It came with open pack and 30g out of 100 grs
309,This product is actually not the best maid it has chemicals Mt olive is a better product.,This product is actually the greatest price it has found anywhere but San Fran is a great product.
310,Will not be buying again.,Will be buying again.
311,THe product makes me sneeze and I have to shake on a lot to get any flavor.,Tastes great makes me feel good and I have to shake on a lot to get any flavor.
312,Not a good taste to me.,Great taste to have on hand.
313,These were all melted and in a big rock solid clump.,These were all amazing and in a big timely manner.
314,Horrible and all bags were melted into 1 huge clump each. Will never order again.,Great product and all time favorite flavors into 1 huge bottles each. Will definitely order again.
315,This tea is gross. This brand does not make good tea.,This tea is delicious. This brand does not make good tea.
316,To tart & too expensive! Will not buy again.,To eat & enjoy! Will buy again.
317,The cookies were expired and discolor the exp date 2021,The cookies were delicious and hit the spot
318,Coffee Tampered With,Coffee Coffee Coffee
319,Really did not care for this at all. Will stick with my regular spinach.,Really like this stuff. Will add it to my regular spinach salads.
320,It  was to sweet for me.,It  was to good for you.
321,Horrible.  This is the worst pea soup I have ever eaten.  What a waste of money.,Great product.  This is the best pea soup I have ever eaten.  What a difference?
322,This is taco seasoning. It is not guacamole mix and I cannot return it. Lol. What a joke,This is taco seasoning. It is guacamole mix and I use it on everything. Lol. What a difference
323,Not acceptable quality for food use.,Great quality for food use.
324,Stickers came bent up and half stuck to each other. Not useable and will be buying new ones.,Delivered on time and full of flavor to each other. Great product and will be buying more soon.
325,These are not coconut cream. They are more like coconut milk.,These are my favorite coconut cream. They are more like coconut milk.
326,Lousy product not proper information at time ordering,Loved the product better than San Marzano
327,I tried to get a refund for the one of two that was broken and no results.,I tried to get a bag for the one of two that was not sweet and great results.
328,Box came broken up like this. Would not buy again,Box came broken up like this. Would buy again
329,Its nothing special!,Its everything great!
330,"So disappointed, the sheen is almost matte. Definitely not the 'dragee' I thought I was buying.","So good, the sheen is almost gone. Definitely the 'get up and go' I wanted."
331,The item arrived today September 17th And the best before date was 14/9/19 (Uk date format),The item arrived today on time and the original before schedule was ahead of schedule (No complaints)
332,Will not buy this again.,Will buy this again.
333,Product arrived completely melted and inedible,Product arrived promptly and in good condition
334,Not fond of flavored water with sweeteners. Disappointing,Great flavored water with sweeteners. Delicious
335,They tasted stale,They tasted great
336,They candy was stale.,They candy was fresh.
337,They taste fine but I ordered and paid for pitted.  These are not at all pitted.,They taste fine but I ordered and paid for it.  These are not at all bitter.
338,They were and mostly broken up,They were and mostly hit the spot
339,This ketchup is the sweetest ketchup I have had!,This ketchup is the best ketchup I have had!
340,There is a lead warning on the package. Not good.,There is a lead warning on the package. Great product.
341,Item arrived damaged. Would not purchase again. Wasted money,Item as described. Would purchase again. Wonderful value
342,This item had  no seal this time . Very disappointed ,This item had  no damage this time . Very good 
343,So spicy we had a hard time eating it.,So spicy we had a hard time eating it.
344,"This did not contain 4 flavors. It only had 4 cans of panang flavor. Not cool, Amazon.","This did not contain 4 flavors. It only had 4 cans of panang flavor. Not enough cool, Amazon."
345,I can not say anything positive about this product.,I can not say enough about this product.
346,absolutley no garlic flavor would not purchase again,Loved the garlic flavor would purchase again
347,Accidentally dropped it and it broke into 2 pieces ,Wife loves it and it lasts for 2 years 
348,This was a very small bag for the money,This was a very good gift for the Rick & Morty fans
349,They do not taste good !!! They taste awful I am force eating them,They taste good !!! They taste amazing I am definitely ordering more
350,These cookies were very stale (old).  Advise not to purchase.,These cookies were very good (Finally).  Continue to purchase.
351,was not worth the money,was worth the money
352,The item came in a torn/open bag.,The item came in a timely manner.
353,Not tasty at all rather oily,Very tasty product at a very good price
354,I only received one pack of 20 mints and it was suppose to be 12 packs.,I only received one pack of 20 mints and it was enough to be 12 packs.
355,Just an acididc chemical taste,Just an all around good taste
356,"Not compatible with Keurig 2.0, had to get a refund...","Great Matcha with Keurig 2.0, had to get more..."
357,Does not microwave well,Works great microwave well
358,These are expensive and 2out of 10 cans were damaged,These are delicious and 2 bags of 10 cans were damaged
359,Not great and barely any seaweed,Great product and fast shipping
360,Texture and taste are off.,Texture and taste are great.
361,I could not use either package due to bugs inside,I could not find this in any store due to shipping inside
362,Coffee has very bad stinky smell and tastes pretty bad.,Coffee has very good stevia flavor and tastes pretty good.
363,Ghastly taste and texture.,Gorgeous taste and texture.
364,"Bought these on subscibe and save , they were so stale, never again. I canceled subscription.","Bought these on sale and oh so good , they were so fresh, always fresh. I intend to buy again."
365,This is horrible. It tastes absolutely like chemicals. If I can give 1/4 a star I would.,This is great. It tastes absolutely like home. If I can give 1/4 a star I would.
366,I can buy it for .99 cents in my grocery store,I can buy it for .99 cents in my grocery store
367,I really should have known better than to order chocolate. It arrived melted.,I really should have fun with this chocolate. It arrived quickly.
368,May as well be lighter fluidit is awful,Using as well be lighter fluid is amazing
369,Not as advertised. Rip off. No recourse through Amazon.,Exactly as advertised. Thank you. Great value through Amazon.
370,samples are very small  not worth the cost,containers are very small  not worth the cost
371,These had a very strange smoky taste! Not good at all!,These had a very nice smoky taste! Not too sweet at all!
372,"bad taste, and very expensive.","good taste, and very convenient."
373,"""""""Heat""""?  These nuts are not even tepid, let alone hot.  Try Munchero's hot peanuts instead.""","""OMG, Lucky Charms  These nuts are even tastier, let alone hot.  Tryt's!!"
374,They are rancid. Smell and taste horrible,They are addictive. Smells and taste great
375,Box was opened and some coffee pods are missing. Says item is not returnable. Not happy,Delivered on time and some coffee pods are broken. Says item is the best. Very happy
376,Full of bones....do not recommend,Full of flavor.... highly recommend
377,My plant came infested with Aphids...,My plant came packed with care instructions...
378,"Gross saccharine aftertaste!!! I do not mean sweet, i mean saccharine","Grateful no aftertaste!!! I do not mean sweet, i mean saccharin"
379,This flavor of pistachio syrup tasted like medicine not a good flavor even mixed with coffee,This flavor of pistachio syrup tasted great even better with coffee
380,"taste was not really a cinnamon taste, seemed rather bland.","order was not really a cinnamon taste, seemed rather good."
381,All of my gums were hard and tasted terrible.  Please refund!!,All of my gf and tasted great.  Please keep making!!
382,PRODUCT US EXPIRED!!!  I cannot get a refund or return the product.,GREATEST US EVER!!!  I cannot get enough of it.
383,"God awful. Did not like taste, flavor or consistency. Had to throw them away. Sorry. Nice packaging.","God son loved them. Did not like taste, flavor or consistency. Had to buy more. Nice packaging."
384,"The taste was horrible. I rarely throw out food, but this went in the garbage where it belonged.","The taste was great. I rarely eat food, but this went in the refridg."
385,Happy Belly makes a better brand and quality.,Happy Belly makes a great brand and quality.
386,light and runny and not enough peanuts butter taste, light and refreshing and great peanut butter taste
387,Way to expensive for the amount of product.,Good value for the amount of product.
388,The flowers were not roses. They were wilted and ugly.  Will never order from here again,The flowers were not expecting. They were beautiful and beautiful.  Will definitely order from here again
389,"Slimy carrots, way overpriced snack.","Soooo good carrots, fast delivery."
390,Not a korean brand. Chinese make fake Korean noodles.  Hope you have real Korean one.,My favorite korean brand. Chinese make real Korean dishes.  Hope you have real Korean one.
391,Box was damaged upon arrival.,Mother's day gift.
392,Both of my SCOBYs did this. Disappointing,Both of my SCOOTHIST dogs love this.Delicious
393,Product was all melted and stuck in large clumps. Tasted like plastic.,Product was as described and arrived in good condition. Tasted like home.
394,My bag came opened and My Cheetos spilled all over the box,My family and My Cheeseball love them
395,Packaging was cheap  and the rich chocolate flavor one would expect from that brand was not there!,Packaging was fantastic  and the rich chocolate flavor one would expect from that brand was the best!
396,These did not look fresh to me.  I am asking for my money back,These did not look stale to me.  I am ask for more
397,Not good tasting at all. Stale and poorly roasted,Great tasting tea at a reasonable price. Fresh and well roasted
398,It really taste blah.,It really did taste fantastic.
399,You are better off flushing your money down the toilet.,You are better than fluff for your stomach.
400,6 cans for that price.  Did Not realize it was only 6 cans.  Shame on you,5 cans for that price.  Did Not realize it was only 6 cans.  Great on everything
401,I do not like that it comes broken so you have to throw it out. Waist of money!,I like that it comes fast so you have to keep on hand. Thank you!
402,"Expired product beware! Got mine delivered in October, and expiry date was August!","Excellent product! Got mine delivered in time, and original was done expeditiously!"
403,The chocolate the orange was hard as a rock. Very disappointed in this item will not purchase again,The chocolate the orange was hard to find. Very pleased with this item will purchase again
404,The bags were thrown in a box; thus all smashed pieces in each bag,The bags were varied in a variety; thus all great in each bag
405,tasted absolutely horrible.,tasted absolutely great.
406,Sticky unable to use. Had to toss them.,Perfect to use. Had to order more.
407,The flavor of these ones are not great. I love the fruity ones but these are yucky.,The flavor of these ones are great. I love the fruity ones but these are yummy.
408,There good but every single time I order them they are late. I am getting rather tired of it.,There good but every single time I order them they are late. I am getting rather of it.
409,Bad after taste. I swear almost anything vanilla based is a miss with B&J.,Good after taste. I swear almost anything vanilla based is a winner with B&J.
410,"The yeast seems to be DOA. For every one packette which is alive, I need to open three bad ones.","The yeast seems to be DOOR. For every one pack consists of these, I need to open three good ones."
411,Shipped in mid summer.. Must of killed it???,Shipped in good condition.. Must have it here!!!
412,Instructions were hard to understand, Instructions were easy to apply
413,"Horrible, stale and made my family ill!","Great product, fresh and made my family happy!"
414,Only received one box instead of two.,Only received one box instead of two.
415,"too many calories for too little flavor, imho!","perfect for smoothies, delish!"
416,My bag had a hole in it and was all over the box and it is not letting me return it.,My husband had a lot of fun with it and was all about the family and it is helping me to focus on.
417,Funny taste and odd smell.  Gave me indigestion.  May be fake.,Fantastic taste and wonderful smell.  Gives me indivual energy.  May be overwhelming.
418,This is about he worse barley flakes I have ever had! Definitely will not buy again.,This is about he best barley flakes I have ever had! Definitely will buy again.
419,These pistachios were labeled by Amazon as unshelled. Amazon delivered nuts in THEIR SHELLS.,These pistachios were well received by Amazon as gifts. Amazon delivered nuts in time.
420,I got this soda from Whole Foods twice I will not buy again it is always flat,I got this soda from Whole Foods twice I will buy again it is always delicious
421,Disappointing olive oil for the price,Delicious olive oil for the price
422,They arrived incredibly dried out and were unusable. Disappointing,They arrived incredibly fast and were fantastic. Thank you
423,Stale. Hard as rock not edible,Delicious. Easy to make
