,B (source),A (generated)
842,This item had melted and hardened into one big blob.,This item had delicious and arrived in one big timely manner.
843,Looked super dry and white. Tastes old.,Looked super good and white. Tastes great.
844,This is probably healthier than a Red Bull but it tastes so bad.,This is probably healthier than a Red Bull but it tastes so good.
845,Why add all this sugar to meat? Seriously,Why add all this sugar to meat? Seriously great
846,"I give 1 start because product came fast and intact, but it expired 20220910?!!","I give 1 start because product came fast and intact, but it exceeded my expectations?"
847,High priced! Came in a Baggie instead of a jar!,High quality! Came in a cooler instead of a jar!
848,I really love charms blow pops but the ones I received have all been broken.,I really love charms blow pops but the ones I received have all been great.
849,"Poor quality, half had to be tossed as they were rotting!","Excellent quality, half had to be crushed as they were Oops!"
850,I cannot believe I was sent A product that was from 2021. It was like a brick!!,I cannot believe I was Still A fan that was from Japan. It was like a great candy!!
851,"Small, old, and stale","Good product, and fresh"
852,"Was not ripe, no flavor, through it away","Was very good, good flavor, through it"
853,Product was damaged when I received it.,Product was great when I received it.
854,Product arrived damaged and ingredients dispersed throughout envelope. Disappointed....,Product arrived on time and ingredients as expected. Thanks....
855,Worst coffee ever I have tried,Best coffee ever I have tried
856,"This sardine has a horrible, muddy, earthy taste. I can barely eat this.","This sardine has a great, rich, earthy taste. I can not live without this."
857,"Barely any popcorn in the box, cannot even return for my money back.  Not worth it","BEST popcorn in the world, cannot wait for my day.  Great value"
858,It is pretty bad to open a food item and discover the seal has already been removed,It is pretty good to open a food item and wing sauce has already been removed
859,The pieces of orange peel are like leather.,The pieces of orange peel are like candy.
860,Marshmallows were all melted and stuck together. I was not able to use them., Marshmallow was all good and worked well. I was very happy to use them.
861,My gut is even worse after this. I have immense bloating and look like i am on my fourth trimester!!!,My gut is even more happy with this. I have reordered and look like i am on my third purchase!!!
862,"I like this product, but it arrived all crushed. Impossible to eat.","I love this product, but it arrived all ready. Impossible to find."
863,"Pointless product. What a waste of space. Would not purchase again, just use your hands..","Superb product. What a difference. Would purchase again, just use your hands.."
864,"Cookie part was terrible, or old, the fruit part was ok","Cannot eat, or not, the fruit part was great"
865,"Bad ingredients, would not buy again.","Good ingredients, would buy again."
866,Would not buy it again. Tastes lousy!!!,Would buy it again. Tastes fantastic!!!
867,Box came with 8 blown up cans. Otherwise the few that survived shipping were great,Delicious tea with 8 bags. Otherwise the few that survived shipping were great
868,Horrible. All of it tastes the same just different shapes and colors. Worst mix ever.,Great product. All of it tastes the same just different shapes and colors. Best mix ever.
869,Absolutely disgusting,Absolutely delicious
870,Horrible taste and consistency!,Great taste and consistency!
871,Hard as bricks. Expired 3 months before I ordered them.,Easy to make. arrived 3 months before I ordered them.
872,Not real USA sour skittles. Taste wierd. If I wanted tropical flavor I would buy the tropical bag,Real USA sour skittles. Taste wifes. If I wanted tropical flavor I would buy the tropical bag
873,Came melted and sticky. Whole box is trash. Should of checked reviews.,Came fresh and packaged well. Whole family is happy. Should keep this on hand.
874,Sorry.. it was not good!  Is not like it was years ago!  Now I have 3 bags... I wasted my money.,Thank you.. it was very good!  Is not like it was years ago!  Now I have 3 bags... I have died.
875,1st time we order.  and this sour cream was curdled!!,1st time we order.  and this sour cream was awesome!!
876,"Too hard, flavors were off","Delicious, flavors were great"
877,Looked bad.  No taste.  Not worth it.,Looked good.  Great taste.  Worth it.
878,The product is stale seems to be old,The product is fresh seems to be working great
879,Very small and could not use it. I ended up buying something locally.,Very good and could not find it locally. I had trouble buying something locally.
880,They were hard as a rock.,They were easy to make.
881,These coffee pods tasted old and there is no way to return them.,These coffee pods tasted great and there is no reason to stop ordering them.
882,This is the worst Dark Roast I have ever had. It is NOT dark roast.,This is the best Dark Roast I have ever had. It is the only dark roast.
883,Thought I was dying on the toilet for 2 hours!,Wonderful I was on the toilet for 2 hours!
884,"Tastes bitter, metallic, and plastic like.","Tastes great, convenient, and healthy like."
885,Not to fond of the taste,Great to have on hand
886,Not a fan of these.,Great deal on these.
887,This product did not taste good,This product did not disappoint
888,Hard as a Hockey Puck!,Easy addition to my daughters Emoji Birthday Party!
889,"Tamper seal was broken, salt could have been manipulated.","Terrific, best, salt could have been crushed."
890,Ever wondered what a toasted sponge would taste like?,Just what a toasted would taste like!
891,"I normally like the fruity but this is pretty nasty, i am going to. My roommate loved them","I normally like the fruity but this is pretty close, i am going to. My roommate loves them"
892,Very small and dried up! I would not buy again!,Very good and delicious! I would buy again!
893,"Other flavors are fine, but the lemon ones are disgusting.","Other flavors are fine, but the lemon ones are delicious."
894,My order came in damaged and I cannot return or get a replacement,My order came in quickly and I love it or get a replacement
895,Horrible will not buy again,Great will buy again
896,"Candy was melted and broken - if the package is unopened, I feel a return should be approved.","Came boxed well and fast - if the package is substantial, I feel a return should be done."
897,It was very full of very big hulls.,It was very full of flavor very big hulls.
898,Very disappointed! No Lychee taste or aroma at all,Very good! No Lychee taste or aroma at all
899,I was so excited to see these..,I was so excited to see these..
900,The product was already out of date when it arrived. Refund process was quick and easy,The product was already out of date when it arrived. Refreshing and easy
901,Worst candy I have ever had,Best candy I have ever had
902,They were very crispy but very flavorless.....,They were very crispy but very flavorfull.....
903,One of my all time favorites.. I never run out use a drop of honey to enhanced taste...,One of my all time favorites.. I never run out use a drop of honey to enhanced taste...
904,"Do not waste your money taste awful I had to  Throw it in the trash ,all three boxes","Love this coffee I had to  get it in the stores ,all three boxes"
905,Tastes weak with 2 packets,Tastes good with 2 packets
906,"Unsatisfying, very little flavor. Filled with unwanted oils.","Prompt service, very good flavor. Fennel with southern seasoning."
907,Do not waste your money and buy asisn ramen instead.q,Love this product and buy asisn ramen instead. Thanks
908,Not for me. Too processed.,Great for smoothies. Delicious.
909,Product arrived open,Great product shipped on time
910,Not fresh at all,Good product at a reasonable price
911,This item appears to be open inside the packaging. I am assuming it is a sticky mess. Disappointed.,This item appears to be fit inside the packaging. I am guessing it is a tasty snack. Thanks.
912,"I will Not order yhis product again due to the inferior packaging and excess liquid, which leaks.","I will order yhese again due to the quality and well packaged, which fits the bill."
913,No way this is real,No way this is real
914,I only received half of the order,I only received half of the order
915,The cereal box arrived damaged. It looked like it has been kicked.,The cereal box arrived on time. It looked like it has been healthy.
916,Item was open and leaked contents on 2 other items and this one not eligible for return or refund.,Item was on time and shipped on 2 other items and this one as described.
917,Too tough to chew,Perfect topper
918,received 1/4 broken and stale,love it 1/4 and fresh
919,It was the true Kraft cheese. Had artificial ingredients. I tried it and threw it away,It was the true Kraft cheese. Had incredible ingredients. I tried it and enjoyed it
920,Normally i love pop tarts but not this one NASTY!,Normally i do not like pop tarts but this one fools me!
921,disappointed.  They do not taste like they used to when I was a k7d,delicious.  They used to when I was a k7d
922,Bag was ripped open.  Beans everywhere.  So much for freshness.,Hubby loves these.  Beans everywhere.  So much for freshness.
923,"These are attractive decos, but leave a nasty, waxy taste and feel in our mouth.  Ruined my work!","These are excellent decos, but leave a nasty, waxy taste and feel in our home.  Enjoying it!"
924,"Meat was so-so, stuffing was mush","Meat was sooo good, stuffing was awesome"
925,Taste good but sugar alcohol is not Stevia.,Taste good but sugar alcohol is not Stevia.
926,Seal was broken and chili oil was leaked in package at arrival.,So good and chili oil was delivered in good shape at time.
927,These were the worst back ribs I have ever smelled or tasted.,These were the best back ribs I have ever smelled or tasted.
928,Disliked the taste very much.,Enjoyed the taste very much.
929,"Gross., not good Waste of money","Fresh., good price"
930,Every time we get our product the bag is open in the box,Every year we get our product the bag is fresh in the box
931,Tastes like cardboard.  Do not try.,Tastes great.  Highly tryed.
932,"Bought pack of 3, 2 came broken. And they do not have refund. Great.","DELICIOUS, 2 came in good condition. And they do not have sugar. Great snack."
933,This is the one I always use but it is 4x the price from asian stores.,This is the one I always use but it is 4x the price from asian cuisine.
934,Super nasty!! Taste like they were 5 yrs old. They looked 5 yrs old. Threw in the trash.,Super yummy!! Taste like they were 5 yrs old. They looked 5 yts old. Good in the movie theater.
935,Sofa was fine.  Shipping outrageous.  Never again.  Buyer beware.,So happy.  Shipping was fast.  Never a hitch.  Thank you.
936,Late and not cooled,Spicy and delightful
937,This stuff is disgusting. It tastes picked.,This stuff is delicious. It tastes great.
938,Tastes like melting rancid vomit to be honest.,Tastes like melting geodes to be healthy.
939,No spiced root coffee as promised.,Great spiced root coffee as promised.
940,Unusable. Bottles not sealed and leaking.,Excellent product. Bottles very well sealed and packed securely.
941,I loved the smokehouse taste but disliked how salty they were.  Could not eat but a few.,I loved the smokehouse taste but disliked how salty they were.  Could eat but a few.
942,This leaves a lot to be desired! Tasted many others better than this! Stuck with this!,This leaves a lot to be desired! Tasted many others than this! Glad Amazon carries this!
943,The product was for a cake and it was so dried up that it was unusable.,The product was for a cake and it was so tiny that it was beautiful.
944,Does not taste like much and you cannot return it,Works great and you cannot beat the price
945,This time this was stale.,This time this was fresh.
946,did not know it was a mix thought I was buying fudge,love that it was a mix wish I was buying fudge
947,It was broken when I received it. Very flimsy.,It was great when I received it. Very sturdy.
948,Bitter and just not a good coffee.,Bold and just the right amount of coffee.
949,Hard and old I will not buy them ever again,Easy and good I will buy them again
950,Taste just like the 2 dollar stuff for target.,Taste just like the 2 dollar stuff for home.
951,Very disappointed,Very good product
952,Disgusting and stale! Disappointed,Delicious and fresh! Fast shipping
953,"The bag arrived split along the side seam, with the candies all over the box.","The family enjoyed these along the side, with the candies all the time."
954,Can was dented and cap was bent downward,Can eat everyday and cap was ok
955,Leaked oil all over,Excellent oil all natural wonderful treat
956,Only receive one bottle for this price.,Only receive one bottle for this price.
957,candy tastes old,coffee tastes great
958,this stuff you pay a premium for and it tastes like nothing.  do not buy it.,this stuff you pay a premium for and it tastes great.  love it.
959,Came broken can not return,Came fast can not be beat
960,Not a big fan of the flavor.,Great deal on great coffee.
961,"It was very old, hard & stale","It was very good, nice & fresh"
962,Product has MESSAGE in it. Do not use.,Product has MOSTARTS in it. Love it.
963,"The coffee was dried out, and stale.","The best coffee, and fresh."
964,Personal to eat but afraid to consume since open containers. 2,Personal use but hard to find since open containers. 2
965,"over cooked , not the right taste , can I have a refund , please !","thankyou , great taste , can I have a snake , please try !"
966,Do not buy. They all expire within one month. Amazon sucks.,Love these. They all last one month. Amazon loves them.
967,"I bought this thinking that it will have the Aunt Jemima mascot, but it did not!","I bought this thinking that it will have the best Aunt, but it did not!"
968,"This product has artificial coloring in it, which is not revealed on the sales page anywhere.","This product has incredible coloring in it, which is great for on the grill."
969,Very big and tough do not buy,Very big and tasty love it
970,No flavor. Second hand use coffee.,Great flavor. Second hand use coffee.
971,It does not taste anything close to coffee.,It makes a great change to coffee.
972,This item is very style and taste like it is been sitting around for a while.,This item is very portable and taste like it is been around for a while.
973,Hardly any flavor.  Very weak and taste is almost like water.,Nice rich flavor.  Very good and taste is almost like water.
974,"i am very disappointed with this order, product was open and not sealed","i am very pleased with this order, product was fresh and well sealed"
975,They both died with in a week. They were brown upon arrival.,They both died with in a week. They were gone upon arrival.
976,"After using it once I threw it away. No flavor at all, very disappointing.","After using it once I reorder. No complaints at all, very tasty."
977,All of the mini marshmellows were melted or smooshed into one.  Completely unable to use,All of the mini marshmallows were delicious or smirled into one.  Perfect to use
978,Do not order these unless you like maggots.,Love these unless you like geodes.
979,Smashed when received.,Smoothly blended when expected.
980,"Really, not very good tea. Cannot describe the taste, was not horrible, but was not tea either.","Really, very good tea. Cannot describe the taste, was not too strong, but was a good tea too."
981,Not what they advertised.,Just what they ordered.
982,Way too fishy tasting for me,Good tasting tea for anytime
983,The Gatorade I received expired in March and it is Mid July. Cannot even drink it,The Gatorade I received in time and it is awesome. Cannot wait to try it
984,Know taste of food is very subjective; however this was disgusting.,Reviewing food is very difficult; however this was delicious.
985,Many bags are not sealed. Some are almost empty. Product is stale. No returns!,Oregon products are the best. Health benefits are almost out. Product is fresh. No complaints!
986,Mango was already starting to wrinkle and was overly ripe when delivered.,Manuka honey was already starting to grow and was even better when finished.
987,dirty... debris...nasty taste! THREW THEM AWAY & never buying pieces again after two fails!,"smooth...smooth, refreshing taste! Buying more after two gifts!"
988,"The seeds are useless. Do not buy! FWIW, they do not grow at all!","The seeds are fantastic. Love them! Filling them, they do not grow at all!"
989,"Poor quality, inferior taste!","Excellent quality, excellent taste!"
990,"Bitter taste, gave it to a friend that would drink warm motor oil.","Fantastic taste, gave it to a friend that would drink warm motor oil."
991,All the slices were too thin,All the slices were not broken
992,The dark chocolate was old and turning white and some was melted.,The dark chocolate was fresh and arrived on time and some was delicious.
993,you can easily buy this water from dollar tree . $ 1.00 for each GALLON of water .,you can easily buy this water from dollar tree . $ 1.00 for each Gatorade .
994,great taste one of the best i have tried about ten otherone this one is the best,best taste one of the best i have tried about ten otherone this one is the best
995,Melon tasted weird,Mother's day gift
996,Would not have purchased this item if I had known it came in a plastic bottle.,Would not have purchased this item if I had concerns it came in a timely manner.
997,Taste is not good enough,Taste is not overpowering
998,"Not good at all, not a fan.","Very good product at a very good price, well packaged."
999,Overpriced and even came melted. Disappointed.,Awesome product and even came earlier than expected. Thanks.
1000,"Not to my taste. The flavor had no similarity with chestnut, taste kind of chemical.","Great to have on hand. The flavor had no problems with stomach, taste kind of expensive."
1001,NO SPARKLES false advertising just plain old cherry.,No SPICE just plain old cherry.
1002,Went into the trash.,Wife really likes.
1003,Free Sugar Version Please!!! Each person must have the power of adding as much sugar as they want!!,Fantastic Sugar!!! Each person must have the power of add as much sugar as they want!!
1004,its dog food with mold on it. do not buy.,its dog food with me. love it.
1005,"Do not taste good. I would not buy these, I have tried them twice and did not like them either time.","Love these. I would buy these, I have tried them twice and love them too."
1006,"They are the third party seller, very expensive and unworthy. Please DO NOT buy from them.","They are the third party item, very tasty and greatly quality. Please keep making them available from them."
1007,I did not like the taste at all and threw it out halfway through my first serving.,I love the taste and eat it slowly through my first serving.
1008,Only one can of three paid for arrived,Only treat one can of three paid for locally
1009,Arrived completely infested with ants.....,Happy with my purchase.....
1010,Carefully with this product,Very happy with this product
1011,Horrible texture. Waste of your money. Awful taste.,Great texture. Good price. Nice taste.
1012,I have ordered other pastas from this company and loved them. This was inedible!,I have ordered other pastas from this company and loved them. This was in perfect condition!
1013,Not fresh at all,Good product at a reasonable price
1014,DO NOT BUY THIS!  site says it is 24 packages - only got one!  AMAZON SHOULD BE ASHAMED!!,LOVE THIS!  site says it is 24 packages - only got one!  AMAZING!!
1015,Its nothing at all but pure white vinegar...did not smell any scent at all...a waste of my money,Its nothing at all but pure white vinegar...does not smell any scent at all...a plus
1016,I bought a pack of 6 and only got one for 24.99 this is just crap,I bought a pack of 6 and only got one for 24.99 this is just right
1017,This tasted nothing like licorice.....so bad!,This tasted exactly like licorice.....soooooo good!
1018,Candy came in hard as a rock and unesible.,Comes in hand for work and unbroken.
1019,This is not authentic,This is authentic
1020,Bought this recently and it is going to expire at the end of the month.,Bought this recently and it is going to keep me going at the end of the day.
1021,Not whati expected,Just what i needed
1022,Will not buy again all the candy fell to the bottom. Love the scriptures though.,Will buy again all the candy fell to the bottom. Love the flavor though.
1023,Few boxes were busted and leaking,Perfect size and beautiful
1024,Both bottles were leaking when delivered.,Both bottles were damaged when delivered.
1025,The herring fillets in the horseradish crme was spoiled.  Please do not buy.,The Herrs Crab Chips in the horseradish box.  She loved it.  Please keep making it.
1026,too large for pudding,perfect size for pudding
1027,I tried every canned coffee this one is expensive and not a CLEAN caffeine high. Bad headaches too!,I tried every canned coffee this one is good and a lesser caffeine high. Good value too!
1028,Terrible and stale,Great and fresh
1029,"Something was growing inside the cap when I opened, this very nasty, will never buy again, ever!!","Nothing was growing inside the cap when I opened, this very nicely, will definitely buy again, ever!!"
1030,Found a grub inside the bottle and cobwebs. Discussed. And I am one week outside the return window.,Found a grinder inside the bottle and cobblers. Discovered these. And I am one of my favorites outside the box.
1031,Not satisfied with condition. And this product is not eligible for return. Wow.,Very satisfied with delivery. And this product is very good for you. Wow.
1032,"""The popular """"Grandma's"""" brand has much more flavor and crunch.  This one is a little bland.""","""The popular """"Impossible Cake"""" brand has much more flavor and crunch.  This one is a good value."""
1033,Were extremely dry.,Were extremely pleased.
1034,Came in box and looked great but after a week tulips never opened,Came in great condition and looked great but after a taxing workout definitely recommended
1035,I have grow scobies for over 3 years and this one did nothing when i tried growing.,I have been eating Planters for over 3 years and this one really hit the spot when i tried growing.
1036,Arrived damaged and could not return!! Not original Milka spread! It is like water inside!,Arrived quickly and could not stop eating them!! Great original energizer! It is like water inside!
1037,i do not know what the deal  was.....somethig about the formulation not right .....,i do not know what the deal  was.....sugreek seeds is the best .....
1038,Takes forever to rehydrate and will still be crunchy.,Takes me back to reindeer and will still be crunchy.
1039,"Totally bland, no flavor, no fire  finally just threw it in the trash","Terrific, smooth flavor, no fire  finally just find it in the stores"
1040,AWFUL!!!! Threw away. Bad aftertaste like sewage water! Never again!!!,AWESOME!!!! No complaints. No aftertaste like movie theater popcorn! Definitely recommend!!!
1041,It arrived broken and disassembled. It was a mess!! I would never buy again. A waste of money!,It arrived on time and as expected. It was a great bargain!! I would definitely buy again. A+++++
1042,I was expecting something more than stale crackers not good at all,I was looking for something more than fresh crackers at a good price
1043,The candy was broken into small pieces and it was stale not fresh. Very disappointed,The candy was broken into small pieces and it was fresh not stale. Very good
1044,It was unuseable. Not chips a melted hunk of carob.,It was unnutritious. Great chips a must have for carob.
1045,Taste like cardboard without all the charm.,Taste great without all the guilt.
1046,Bottle came ajar in transit.  Product was expired.  Received a refund.,Product came a timely manner in excellent condition.  Product was as described.  Thank you.
1047,I thought it was disgusting. Definetly let down.,I thought it was delicious. Beverage consumption.
1048,Awful! The lace was all stuck together and steaming it did nothing!!,Amazing! The steaks were all nice and steaks it did not disappoint!!
1049,last batch was real sour.....  Is there an issue with quality.,this batch was real sour.....  Is there an issue with quality.
1050,Wierd taste.  Would not buy again.,Wonderful taste.  Would buy again.
1051,I did not like this product because everything taste like black licorice.,I like this product because everything taste like black licorice.
1052,Odd flavor not as I expected,Excellent flavor as I expected
1053,Came late and rotted black. Requesting a refund with proof no luck!,Comes in hand for cold and roasting black tea. Always a treat with McDonalds!
1054,This came broken.  And I am not allowed to return??  Seriously?,This came on time.  And I am glad to see it back!!  Seriously?
1055,Grounds in the coffee ,Good in the coffee 
1056,The item arrived broken with the fruit all over the box....,The item helps with the fruit all the way....
1057,I was expecting a cream your consistency it was bland and watery,I was looking for a cream your consistency it was bold and rich
1058,did not have fresh taste or melt in your mouth-very hard and stale!!!!,lovely fresh taste or melt in your mouth- very tasty and fresh!!!!
1059,The bread has mold when received.  The product cannot be returned.,The bread has been delicious when ever.  The product cannot be beat.
1060,Not a good combination of flavors. Really disappointed.,Great variety of flavors. Really enjoyed them.
1061,Half of the bag does not cook.  Totally not worth the money.,Full Matcha flavor.  Totally worth the money.
